"paragraph","message","polarity_class","polarity_score","emotion"
"ইম্রান তাও ছিলেন মন্দের ভালো , কিন্তু ইম্রান যাবার পর যারা আসবে তাদের সময় দেশের অবস্তা আরো শোচনিয় হবে বলেই মনে হয় ।","","weaklyNegative",-0.5997665882110595,"{""neutral"":0.015989629551768303,""happy"":0.137793630361557,""anger/disgust"":0.01877133920788765,""sadness"":0.8009372353553772,""surprise"":0.00842815451323986,""fear"":0.4621187448501587}"
"ইয়র্কার খেলেছেন কাপ্তান সাহেব!এখন বুঝলাম বিশ্বকাপ কেমনে পেয়েছিল।","","weaklyNegative",-0.5949880361557007,"{""neutral"":0.2558771073818207,""happy"":0.021047990769147873,""anger/disgust"":0.026783064007759094,""sadness"":0.006200977601110935,""surprise"":0.7944332957267761,""fear"":0.003051473991945386}"
"ইসলামিক ইমুশনসম্পন্ন পাকি তরুণদের দলে আনতে ইমরান খান খুব চিন্তা করে কিছু শব্দ বাছাই করেছিলেন। ""রিয়াসাতে মদীনা"", "" খিলাফাহ"" যা আমজনতা পছন্দ করে। কিন্তু তার রিয়াসাতে মদীনার যে মডেল শো করা হয়েছে তা পিউর পূঁজিবাদী স্ক্যান্ডিনেভিয়ান দেশগুলো থেকে নেয়া। মার্কিন প্রেসক্রিপশনের লিবারেল ইসলাম কিন্তু বক্তব্যগুলো সবসময় বৈপ্লবিক। গত কয়েক বছরে মুসলিমদের বিরুদ্ধে এমন কিছু কাজ করে ফেলেছে তার সরকার যা নওয়াজ কিংবা জারদারীর মতো লোকের পক্ষে সম্ভব ছিল না। নির্বিঘ্নে আরো কিছুদিন ক্ষমতায় থাকলে পাবলিক তার বিরুদ্ধে এমনিতেই মাঠে নামতো যেহেতু মুখোশ সবার সামনে উন্মুক্ত হয়ে যেত। ঠিক এই সময়ে হালকা কিছু ক্যাঁচাল লাগিয়ে ক্লাউনটাইপ বিরোধীদলগুলোকে মাঠে নামিয়ে ইমরানের সকল পূর্বপাপ মুছে ফেলে তাকে রীতিমতো কিংবদন্তী বানিয়ে দিল। কারণ পাবলিক ইমুশন প্রচন্ড এন্টি আমেরিকান। একদম জায়গামতো এন্টি আমেরিকান শ্লোগান দিয়ে এখন ইমরান হিরো। অথচ একটা কাজও তার এন্টি আমেরিকান ছিল না। এখন বিরোধীদলগুলো দুদিন সরকারে থেকে নিজেরাই হাউকাউ করবে ভাগাভাগি নিয়ে। এদিকে পূতপবিত্র ইমরান খান (আধ্যাত্মিক শান্তির জন্য মহিলা তান্ত্রিকের কাছে যেত, পরে বিয়ে করে নিয়েছে অবশ্য। 😃😃😃) আবারো বিপুল জনসমর্থন নিয়ে ক্ষমতায় এসে নিশ্চিন্তে এন্টি আমেরিকান শ্লোগান দিয়ে আমেরিকারই সেবা করে যাবে। এটাই সাইন্স, পলিটিক্যাল সাইন্স!!!","","stronglyNegative",-0.9995167970657348,"{""neutral"":0.011313967406749725,""happy"":0.16331622004508972,""anger/disgust"":0.8146563172340393,""sadness"":0.32134416699409485,""surprise"":0.13844247162342072,""fear"":0.0746583640575409}"
"ইসলামিক দুই নেতা বর্তমানের পাকিস্তানের প্রধানমন্ত্রী ইমরান খাঁন ও তুরষ্কের প্রধানমন্ত্রী এরদোয়ান, আল্লাহ তায়ালা দুজন কে নেক হায়াত দান করুক,এবং দীর্ঘদিন এইভাবে দেশের ইসলামের উপর সঠিক নেতৃত্ব দেওয়ার তাওফিক দান করুক আমিন,ইমরান খান ক্ষমতা হারালে পাকিস্তান পশ্চিমাদের হাতের পুতুল হয়ে যাবে এটা স্পষ্ট!","","weaklyNegative",-0.5966988563537597,"{""neutral"":0.1153554692864418,""happy"":0.8162203431129456,""anger/disgust"":0.049448125064373016,""sadness"":0.24556197226047516,""surprise"":0.027901461347937584,""fear"":0.10740940272808075}"
"ইসলামের পক্ষে যে কাজ করবে সে যদি পৃথিবীর নিকৃষ্ট দেশের হয় তবু তাকে স্বাগতম। ইসলামের পক্ষে বলিষ্ঠ কণ্ঠস্বর ইমরান খান।","","stronglyPositive",0.9990806818008424,"{""neutral"":0.06381393224000931,""happy"":0.9344381093978882,""anger/disgust"":0.02035774290561676,""sadness"":0.008379684761166573,""surprise"":0.036363814026117325,""fear"":0.002463442739099264}"
"ইসসস ৫ বছর থাকতে পারলো না।","","weaklyNegative",-0.5908682823181153,"{""neutral"":0.001144092413596809,""happy"":0.0015030496288090944,""anger/disgust"":0.0021748326253145933,""sadness"":0.9943431615829468,""surprise"":0.0009873323142528534,""fear"":0.0015826900489628315}"
"ইহা একটি সাও*****র দেশ।","","neutral",-0.19961116313934327,"{""neutral"":0.9595853686332703,""happy"":0.002445594873279333,""anger/disgust"":0.034984324127435684,""sadness"":0.007932941429316998,""surprise"":0.02014460414648056,""fear"":0.0017741505289450288}"
"ইহুদি,নাসা কাপের দের ষড়যন্ত্রে সুলতান সুলেমান সহীহ্ ইসলামের প্রচারক দেশরত্ন দেশের গর্ব ইমরান খান কে তাদের দেশ ভালোবাসলনা,তার যথাযথ মর্যাদা দিতে পারল না তারা বুঝল না, যা বাংলাদেশ সহ সকল দেশ বুঝলো, হাইরে হতভাগ্য পাকিস্তান, বলদ পাকিস্তান, গাধা পাকিস্তান, ভারতের দালালদের কাছে বারবার হারমেনে নেই এই পাকিস্তান।","","stronglyNegative",-0.999746298789978,"{""neutral"":0.0029325638897717,""happy"":0.008151767775416374,""anger/disgust"":0.9505429267883301,""sadness"":0.18212071061134338,""surprise"":0.008938630111515522,""fear"":0.015675747767090797}"
"ঈদ মোবারক রুহানি সন্তানরা","","stronglyPositive",0.9353760957717896,"{""neutral"":0.00327878980897367,""happy"":0.9963794350624084,""anger/disgust"":0.00044506098493002355,""sadness"":0.0008764220983721316,""surprise"":0.0003883733006659895,""fear"":0.00009692565799923614}"
"ঈদ মোবারক।","","neutral",0.19745267629623414,"{""neutral"":0.057647887617349625,""happy"":0.973773717880249,""anger/disgust"":0.00047396885929629207,""sadness"":0.0007914380403235555,""surprise"":0.000993918045423925,""fear"":0.0002084738080156967}"
"উনার উচিত ছিল আমাদের প্রধানমন্ত্রী এর কাছ থেকে শিখে যাওয়া যে ক্ষমতায় কিভাবে টিকে থাকতে হয়।","","weaklyNegative",-0.44400994777679437,"{""neutral"":0.010168837383389473,""happy"":0.0018574506975710392,""anger/disgust"":0.9326727390289307,""sadness"":0.0843563973903656,""surprise"":0.005093580111861229,""fear"":0.0023726625367999077}"
"উনি ঘুরে দাড়াবেন ইন-শা-আল্লাহ। আজ দুনিয়াজুড়ে মুসলিমদের সেন্টিমেন্ট ও ন্যারেটিভকে রিপ্রেজেন্ট করার মত হাতে গুনা মাত্র এক-দুইজন নেতাই রয়েছেন। উনি তাদের মধ্যে উন্নতম। আল্লাহ উনার সহায় হবেন ইন-শা-আল্লাহ।","","stronglyPositive",0.9991698265075685,"{""neutral"":0.01115654781460762,""happy"":0.9920656085014343,""anger/disgust"":0.005931684747338295,""sadness"":0.012817122973501682,""surprise"":0.007832060568034649,""fear"":0.0038743067998439074}"
"উনি প্লে-ডাউন হয়ে আউট হয়েছেন ! 😜","","weaklyNegative",-0.5997971534729003,"{""neutral"":0.8809830546379089,""happy"":0.0009572096168994904,""anger/disgust"":0.0015079345321282744,""sadness"":0.2234330028295517,""surprise"":0.004084547515958548,""fear"":0.0026533068157732487}"
"উনি বোধহয় আমাদের ইনাকে ফলো করে সফলভাবে ভোটে জিতে দীর্ঘদিন ক্ষমতায় থাকতে চান।","","stronglyPositive",0.9925931692123414,"{""neutral"":0.035272516310214996,""happy"":0.0036340076476335526,""anger/disgust"":0.7095876932144165,""sadness"":0.03790850192308426,""surprise"":0.35447463393211365,""fear"":0.02053610235452652}"
"উভয়ে মধ্য রাতের সরকার","","neutral",-0.19962093830108643,"{""neutral"":0.014958225190639496,""happy"":0.003064363496378064,""anger/disgust"":0.9368690848350525,""sadness"":0.04656524211168289,""surprise"":0.022265398874878883,""fear"":0.04149749502539635}"
"এ জন্য মুসলীম লীগ থেকে আওয়ামী লীগ সৃষ্ট হয়েছিল।","","neutral",-0.19997189044952393,"{""neutral"":0.8825138211250305,""happy"":0.014793592505156994,""anger/disgust"":0.06822337955236435,""sadness"":0.011007480323314667,""surprise"":0.05924629420042038,""fear"":0.0020399729255586863}"
"এ হালা চাপাবাজ","","stronglyNegative",-0.9999177694320679,"{""neutral"":0.00019273882207926363,""happy"":0.00022482671192847192,""anger/disgust"":0.9994644522666931,""sadness"":0.0013772904640063643,""surprise"":0.00023119873367249966,""fear"":0.000011461201211204752}"
"এই আরেক পরিবার (নওয়াজ)ঠিক শ্রীলঙ্কার রাজাপাকস এর মত। পাকিস্তানের সব লুটপাট করে রাষ্ট্রকে দেউলিয়া বানিয়েছে। এখনও ষোল কলা পূর্ন হয় নাই।","","weaklyNegative",-0.5998047351837158,"{""neutral"":0.0008910320466384292,""happy"":0.000925373868085444,""anger/disgust"":0.9868844747543335,""sadness"":0.0817725658416748,""surprise"":0.00463258009403944,""fear"":0.00391640467569232}"
"এই কথা বলিয়েন না তাহলে বাংলাদেশের পাকিস্তানের নাজায়েজ বাচ্চা গুলো খুব খেপে যাবে","","stronglyNegative",-0.9998975992202759,"{""neutral"":0.0003038643626496196,""happy"":0.00027033427613787353,""anger/disgust"":0.9985793828964233,""sadness"":0.005618118215352297,""surprise"":0.0004630794283002615,""fear"":0.00019328060443513095}"
"এই ঘটনাই প্রমান করে ওনি কতটা সৎ ছিলেন,,","","stronglyPositive",0.9999069452285767,"{""neutral"":0.003080688649788499,""happy"":0.9915197491645813,""anger/disgust"":0.0033825307618826628,""sadness"":0.00032195178209804,""surprise"":0.004232843406498432,""fear"":0.0000332206254824996}"
"এই চোর এক মাসের বেশি ক্ষমতায় থাকতে পারবে না।😁","","stronglyNegative",-0.9995520830154419,"{""neutral"":0.0184398852288723,""happy"":0.003984447568655014,""anger/disgust"":0.7944786548614502,""sadness"":0.2487175166606903,""surprise"":0.003612254513427615,""fear"":0.008775437250733376}"
"এই ছেলে পাকিস্তানের ১ম স্থানের খারাপ লোক, এর মাকে মানুষে মারছে গুলি করে, বাপে একটা সয়তান চোর, নানায় ছিলো চোর, পাকিস্তানের একজন মানুষ অন্যজন মানুষকে সহ্য করতে পারে না। পারবে কেমনে, কেউ ভালো না। আমাদের ভাগ্য ভালো, আগেই আমরা কেটে আসছি। আল হামদুলিল্লাহ।","","stronglyNegative",-0.9997876882553101,"{""neutral"":0.006583098322153091,""happy"":0.19589821994304657,""anger/disgust"":0.9181543588638306,""sadness"":0.14825764298439026,""surprise"":0.01398379635065794,""fear"":0.020022351294755936}"
"এই পাকিস্তান কোনো দিন ভালো হবেনা। ইমরান খানের মতো একজন মানুষ পাওয়া বড় কঠিন। এখানে একটা জিনিস বোজাজায় দূর্নীতি বাজরা দূর্নীতি করতে পারেনা তাই ইমরান খান কে বাদদিয়ে দেয়। সুদু খতি হবে সাধারণ মানুষের","","weaklyNegative",-0.5991487503051758,"{""neutral"":0.01004863902926445,""happy"":0.19900557398796082,""anger/disgust"":0.556406557559967,""sadness"":0.7269250750541687,""surprise"":0.019939012825489044,""fear"":0.07314904034137726}"
"এই পাকিস্তানি সরকার আমাদের দেশের সরকারকে রাজাকার বানাইতে চায়, এটা আমরা মানি না,,🤔🤔🤔","","stronglyNegative",-0.9999067544937134,"{""neutral"":0.0037663441617041826,""happy"":0.0013623707927763462,""anger/disgust"":0.9803446531295776,""sadness"":0.02880064584314823,""surprise"":0.0025517011526972055,""fear"":0.0027833404019474983}"
"এই বাচ্চা কমেডিয়ানটা।","","stronglyNegative",-0.9997944831848145,"{""neutral"":0.7179625630378723,""happy"":0.15312069654464722,""anger/disgust"":0.022727878764271736,""sadness"":0.028636854141950607,""surprise"":0.10227636247873306,""fear"":0.010908226482570171}"
"এই বিলাওয়াল ভুট্টো আগের পররাষ্ট্রমন্ত্রী(২০১১-২০১৩)হিনা রব্বানী খার এর সাথে পরকিয়া প্রেম করতো এরকম নিউজ তো দেখেছি।তাহলে খারাপ হবে না অভিজ্ঞতা আছে।","","weaklyNegative",-0.5995324850082397,"{""neutral"":0.08819901943206787,""happy"":0.046029284596443176,""anger/disgust"":0.5759276747703552,""sadness"":0.33524614572525024,""surprise"":0.10450393706560135,""fear"":0.2096845805644989}"
"এই শালা পশ্চিমা দালালদের কারণে পাকিদের এই অবস্থা।","","stronglyNegative",-0.9999245882034302,"{""neutral"":0.00028664220008067787,""happy"":0.00026946014259010553,""anger/disgust"":0.9985929131507874,""sadness"":0.004778201226145029,""surprise"":0.0005098519613966346,""fear"":0.00008203180914279073}"
"এই শুয়োর টা ঠিক মতো উর্দু ও বলতে পারে না...?","","stronglyNegative",-0.9997998237609863,"{""neutral"":0.00013127241982147098,""happy"":0.00008179864380508661,""anger/disgust"":0.9996205568313599,""sadness"":0.0006911366363056004,""surprise"":0.0025333573576062918,""fear"":0.00002095803756674286}"
"এই ষড়যন্তের মূল নায়ক ভারত ও আমেরিকা ,,,আর কিছু দুর্নীতিবাজ বিরোধী নেতা যাদের টাকা দিয়ে কিনে ,ইমরান সরকারের বিরুদ্ধে অনাস্থা দিয়েছে ۔۔۔۔পশ্চিমা ও আমেরিকাদের বিরুদ্ধে গেলে ইমরান খানের মতো অবস্থা হবে মুসলিম শাসকদের ,,,এখন বুঝতে হবে ইমরান খান সঠিক পথেই ছিল ۔۔۔সে দেশ প্রেমিক","","weaklyPositive",0.5999379634857178,"{""neutral"":0.019808782264590263,""happy"":0.0838007777929306,""anger/disgust"":0.8673574924468994,""sadness"":0.2624252438545227,""surprise"":0.03314807638525963,""fear"":0.09340820461511612}"
"এই সব মীর জাফর দের আল্লাহ শাস্তি দেবে","","stronglyNegative",-0.9993324041366577,"{""neutral"":0.0067266481928527355,""happy"":0.019814977422356606,""anger/disgust"":0.9276759624481201,""sadness"":0.07192463427782059,""surprise"":0.0023421114310622215,""fear"":0.00667695002630353}"
"এই সমস্ত আবোল তাবোল কথা বলে লাভ নাই তুই হালা ইমরান তোর চেহারা দেখলেই মনে হয় তুই একটা জঙ্গি তাই রাজনীতি করার দিন তোর শেষ হয়ে গেছে এখন তালেবানের সঙ্গে গিয়ে যোগ দে।","","stronglyNegative",-0.9999341011047364,"{""neutral"":0.0001281626900890842,""happy"":0.0003169169358443469,""anger/disgust"":0.9992895126342773,""sadness"":0.008741644211113453,""surprise"":0.00034760998096317053,""fear"":0.00012191390851512551}"
"এই সরকার ও বেশিদিন টিকবেনাহ। চীন রাশিয়া কখনোই চাইবেনাহ পাকিস্তান সরকার আমেরিকার বলয়ে থাকুক 😅","","weaklyNegative",-0.4814827680587768,"{""neutral"":0.030707143247127533,""happy"":0.005845012608915567,""anger/disgust"":0.793343722820282,""sadness"":0.3028423488140106,""surprise"":0.007972897961735725,""fear"":0.027121160179376602}"
"এই সাপ টাও বেশি নড়াচড়া করতাছে 🐸","","neutral",-0.11882927417755128,"{""neutral"":0.13979583978652954,""happy"":0.008746830746531487,""anger/disgust"":0.1785280406475067,""sadness"":0.09791293740272522,""surprise"":0.33182492852211,""fear"":0.4131653606891632}"
"এইটা আজকে বুঝলেন নাকি,","","weaklyNegative",-0.5791187047958374,"{""neutral"":0.21715667843818665,""happy"":0.0019732369109988213,""anger/disgust"":0.7529422044754028,""sadness"":0.013709824532270432,""surprise"":0.11517264693975449,""fear"":0.0011112975189462304}"
"এইটাও বেশিদিন টিকবে না 😁","","weaklyNegative",-0.5995984315872191,"{""neutral"":0.0025030607357621193,""happy"":0.002581882756203413,""anger/disgust"":0.0094229057431221,""sadness"":0.9902290105819702,""surprise"":0.001914581866003573,""fear"":0.007481993641704321}"
"এক গোয়ালের গরু","","weaklyNegative",-0.5915923833847045,"{""neutral"":0.2566305696964264,""happy"":0.010891606099903584,""anger/disgust"":0.1335446685552597,""sadness"":0.05724532902240753,""surprise"":0.5991184115409851,""fear"":0.0234625656157732}"
"এক পাঠান সর্দারকে ইংরেজরা ঐশ্বর্যের লোভ দখিয়ে বশ্যতা স্বীকার করতে বলেছিল। উত্তরে পাঠান সর্দার বলেছিল ""তোমাদের দেওয়া ঐশ্বর্য পূর্ন গোলামীর জিবনের চেয়ে আমার স্বাধীন বিপদসংকুল জীবনই স্রেয়""! এই হলো ইমরান খান।","","neutral",0.18774524927139283,"{""neutral"":0.10330351442098618,""happy"":0.12876911461353302,""anger/disgust"":0.4019492566585541,""sadness"":0.512627899646759,""surprise"":0.10164827853441238,""fear"":0.2558772563934326}"
"এক বন্ড মাওলানা র( ফজলুর রহমান) প্রতারণা য় ইমরান খানের পতন নিশ্চিত হইছেমুসলমান দের আটশত বছরের শাসনের পতন ও মাওলানা গুলার ফতোয়া আর বেইমানি র কারনে বন্ড মাওলানা ফজলুর রহমান ইমরান খানকে সরাসরি ইহুদী Agent বলে ফতোয়া দিছে। গত কয়েক দিনের পাকিস্তান নিউজ channel গুলাতে এটা ফলাও করে প্রচার ও করছে। হাস্যকর!","","stronglyNegative",-0.9996355056762696,"{""neutral"":0.007381192408502102,""happy"":0.010697668418288231,""anger/disgust"":0.8978546261787415,""sadness"":0.22973982989788055,""surprise"":0.04926127940416336,""fear"":0.07988936454057693}"
"এক সফল ও গৌরবময় অধ্যায়ের শেষ... পশ্চিমা বিশ্বের রক্তচক্ষুকে উপেক্ষা করে ইসলাম তথা মুসলিম বিশ্বকে স্বমহিমায় নেতৃত্বদানকারী ইমরান খানকে ...সময় ও ইতিহাস পাতায় ও সমস্ত মুসলমানদের হৃদয়ের থেকে যাবে আজীবন.","","stronglyPositive",0.9999285459518434,"{""neutral"":0.005614424590021372,""happy"":0.9918797612190247,""anger/disgust"":0.007045871112495661,""sadness"":0.011847922578454018,""surprise"":0.06976552307605743,""fear"":0.003353007137775421}"
"একই ঘাটের মাঝি","","neutral",-0.1999750852584839,"{""neutral"":0.9832178354263306,""happy"":0.003648837562650442,""anger/disgust"":0.0051378412172198296,""sadness"":0.0004219025431666523,""surprise"":0.0072735813446342945,""fear"":0.00024264221428893507}"
"একজন ভদ্র ক্রিকেটার কাপুরুষ প্রধানমন্ত্রী কে হারালো পাকিস্তানের জনগণ 😬","","stronglyNegative",-0.9998255014419556,"{""neutral"":0.021838178858160973,""happy"":0.02624952234327793,""anger/disgust"":0.7939316034317017,""sadness"":0.28833380341529846,""surprise"":0.03841306269168854,""fear"":0.0229230597615242}"
"একজন মুসলিম শাসকের পররাষ্ট্রনীতি যেভাবে হওয়ার দরকার ছিল ইমরান খান তাহাই করছে ইমরান খান একজন ধর্মভীরু মানুষ আল্লাহ তাকে হেফাজত করবে","","weaklyPositive",0.5825387001037599,"{""neutral"":0.11420319229364395,""happy"":0.5318053960800171,""anger/disgust"":0.4527468681335449,""sadness"":0.15007859468460083,""surprise"":0.023422207683324814,""fear"":0.04395837336778641}"
"একজন সিকৃত চোর বাচার জন্য একজন ভাল মানুষকে চোরের তাকমা দিতেই পারে","","stronglyNegative",-0.9994549512863159,"{""neutral"":0.01113093737512827,""happy"":0.005508934147655964,""anger/disgust"":0.8684127926826477,""sadness"":0.13324664533138275,""surprise"":0.01955847255885601,""fear"":0.045671090483665466}"
"একটা নির্দিষ্ট দাম দিয়ে উনি এগুলো ক্রয় করে নিয়েছেন তোষাখানা থেকে। এটি আইন অনুসারে বৈধ।","","weaklyPositive",0.5805855989456178,"{""neutral"":0.6712390780448914,""happy"":0.13301533460617065,""anger/disgust"":0.08741944283246994,""sadness"":0.014635654166340828,""surprise"":0.05050578713417053,""fear"":0.0025376928970217705}"
