"paragraph","message","polarity_class","polarity_score","emotion"
"আপনারা বাংলাদেশে ইমরান চর্চা কেনো এতো করছেন বুঝে উঠতে পারছি না।","","weaklyNegative",-0.5998924016952514,"{""neutral"":0.04806486517190933,""happy"":0.028067046776413918,""anger/disgust"":0.7293481826782227,""sadness"":0.17342263460159302,""surprise"":0.169873908162117,""fear"":0.008968375623226166}"
"আপনি আবারো ফিরবেন ইমরান খান আপনার সেই আসনে ইনশাআল্লাহ। আপনার কয়েকটি সফলতার মধ্যে আমেরিকার দালালি না করার সফলতা সবার আগে। বিশ্বাসঘাতক ও মীর জাফররা আছে থাকবে দালালী করবে।ওরা করুক, বিচার একদিন হবেই।","","neutral",0.1544450879096985,"{""neutral"":0.012207793071866035,""happy"":0.7026664614677429,""anger/disgust"":0.7309226989746094,""sadness"":0.10475040972232819,""surprise"":0.008378444239497185,""fear"":0.012055625207722187}"
"আপনি দুধে ধোয়া তুলসি পাতা","","neutral",-0.19369336366653445,"{""neutral"":0.30401477217674255,""happy"":0.01852990686893463,""anger/disgust"":0.45508286356925964,""sadness"":0.02638198621571064,""surprise"":0.10936751216650009,""fear"":0.013120523653924465}"
"আপনি নওয়াজ শরীফ থেকে অনেক ভাল কাজ করেছেন।","","stronglyPositive",0.9999081850051881,"{""neutral"":0.0008197535644285381,""happy"":0.9983547329902649,""anger/disgust"":0.0032332544215023518,""sadness"":0.0015087791252881289,""surprise"":0.0007076679030433297,""fear"":0.00008652315591461957}"
"আপনি ফেরেস্তা 😏","","weaklyPositive",0.5762801408767702,"{""neutral"":0.15321257710456848,""happy"":0.46973446011543274,""anger/disgust"":0.3152658939361572,""sadness"":0.009825763292610645,""surprise"":0.026571009308099747,""fear"":0.0027813853230327368}"
"আপনি লন্ডনে খুব আরামে আছেন","","stronglyPositive",0.9998538017272951,"{""neutral"":0.00021005365124437958,""happy"":0.9996457099914551,""anger/disgust"":0.0003204690001439303,""sadness"":0.00044553130283020437,""surprise"":0.00045379868242889643,""fear"":0.000024891345674404874}"
"আপনি হলেন দৃর্নীতির বরপুত্র! নিরপেক্ষ ভোট হলে ইমরানের সাথে দৌড়াতে পারবেন কি!","","weaklyNegative",-0.5944981575012207,"{""neutral"":0.5459145903587341,""happy"":0.028673464432358742,""anger/disgust"":0.47612282633781433,""sadness"":0.07800642400979996,""surprise"":0.08277509361505508,""fear"":0.026728197932243347}"
"আপাত মস্ত ভদ্রলোকের নাম হচ্ছে ইমরান খান! পাকিস্তানের ভদ্রলোকদের রাজনীতি করা নিষেধ! পাকিস্তানের জনগণের উচিত ইমরান খানের পাশে থাকা,,, কারণ ইমরান খান জ,ঙ্গিবা,দকে অনেকটাই নিয়ন্ত্রণ করতে সক্ষম হয়েছে এবং পাকিস্তানে ক্রিকেট ফিরিয়ে এনেছে,,,, ইমরান খান ক্ষমতাচ্যুত হলে পাকিস্তানসহ ভারতীয় উপমহাদেশে জ,ঙ্গিবা,দের উত্থান হতে পারে,,,","","weaklyPositive",0.5020087242126465,"{""neutral"":0.07370784133672714,""happy"":0.8429730534553528,""anger/disgust"":0.08876406401395798,""sadness"":0.21759414672851562,""surprise"":0.05062750726938248,""fear"":0.18470224738121033}"
"আপ্নিও ছিলেন। এক্সময়।","","stronglyPositive",0.8338172674179078,"{""neutral"":0.8846327662467957,""happy"":0.23069091141223907,""anger/disgust"":0.005145685747265816,""sadness"":0.001958457287400961,""surprise"":0.002142038196325302,""fear"":0.0006077825091779232}"
"আফগানিস্তান, পাকিস্তান, ও বাংলাদেশ এই দেশে নিজেদের মধ্যে ঝামেলা সৃষ্টি করা খুব সহজ. ভারতে সম্ভব না","","stronglyNegative",-0.9997246265411377,"{""neutral"":0.05133814737200737,""happy"":0.004958630073815584,""anger/disgust"":0.7242730259895325,""sadness"":0.44574394822120667,""surprise"":0.015017110854387283,""fear"":0.010308533906936646}"
"আবার আসবেন।","","neutral",0.19952833652496338,"{""neutral"":0.2922869026660919,""happy"":0.8446109294891357,""anger/disgust"":0.0040305727161467075,""sadness"":0.006312282755970955,""surprise"":0.0013104291865602136,""fear"":0.0006595803424715996}"
"আবারও আসবেন এমরান খান ✌️✌️","","weaklyPositive",0.4091077566146851,"{""neutral"":0.029942741617560387,""happy"":0.9714940190315247,""anger/disgust"":0.003888781415298581,""sadness"":0.00227919383905828,""surprise"":0.013175575993955135,""fear"":0.0006298402440734208}"
"আবারও পাকিস্তানের প্রধানমন্ত্রী হবে ইমরান খান","","weaklyPositive",0.580799698829651,"{""neutral"":0.3601597547531128,""happy"":0.6171758770942688,""anger/disgust"":0.009265325032174587,""sadness"":0.0010966469999402761,""surprise"":0.010168367065489292,""fear"":0.0003987568779848516}"
"আবারো বীরের বেশে আসবে ফিরে ইমরান খান (আপোষহীন মুসলিম নেতা ইমরান খান) ইনশাআল্লাহ্","","stronglyPositive",0.9998938322067261,"{""neutral"":0.007176766637712717,""happy"":0.9923450350761414,""anger/disgust"":0.003218557918444276,""sadness"":0.0010730333160609007,""surprise"":0.0017371269641444087,""fear"":0.00022691157937515527}"
"আম পাঠানোর সময় আসিতেছে।","","neutral",0.19953706264495852,"{""neutral"":0.0789775550365448,""happy"":0.9603630304336548,""anger/disgust"":0.002153074834495783,""sadness"":0.0018208901165053248,""surprise"":0.001053412677720189,""fear"":0.0003870775690302253}"
"আমরা আশাবাদী ইমরান খান আবার ফিরবেই","","weaklyPositive",0.5873359441757203,"{""neutral"":0.029689576476812363,""happy"":0.9773937463760376,""anger/disgust"":0.003898327937349677,""sadness"":0.0013558282516896725,""surprise"":0.0008153877570293844,""fear"":0.0002442754339426756}"
"আমরা আশাবাদী ইমরান খান আবার ফিরবেইভালবাসার অপর নাম, সাহসী বীর ইমরান। দোয়া ও ভালবাসা রহিল।","","stronglyPositive",0.9999397277832032,"{""neutral"":0.0024791499599814415,""happy"":0.9980277419090271,""anger/disgust"":0.0009183519869111478,""sadness"":0.0012664733221754432,""surprise"":0.0009871545480564237,""fear"":0.00021244246454443783}"
"আমরা পাকিস্তান নিয়ে মাতা মাতি না করি","","weaklyNegative",-0.5968691825866699,"{""neutral"":0.013353628106415272,""happy"":0.006429586093872786,""anger/disgust"":0.9051478505134583,""sadness"":0.1503668874502182,""surprise"":0.012991041876375675,""fear"":0.03650924190878868}"
"আমরা সব ভালো রাজনৈতিক নেতা পেয়েছি, ইনারা এসব করেন না।","","weaklyNegative",-0.5245563745498657,"{""neutral"":0.01801450550556183,""happy"":0.10441729426383972,""anger/disgust"":0.5594763159751892,""sadness"":0.3547029495239258,""surprise"":0.04561745002865791,""fear"":0.005297671537846327}"
"আমরাও রাজাকার‌দের কথা ম‌নে ক‌রি‌য়ে দি‌তে চাই","","weaklyNegative",-0.5775686979293824,"{""neutral"":0.005212395917624235,""happy"":0.0013417041627690196,""anger/disgust"":0.9210795164108276,""sadness"":0.10310143232345581,""surprise"":0.0034803948365151882,""fear"":0.010845127515494823}"
"আমাদের এখন অনেক মিল, শাহবাজ ও রাতের ভোট এ নির্বাচিত","","neutral",0.19994651079177858,"{""neutral"":0.06024422124028206,""happy"":0.022429080680012703,""anger/disgust"":0.661104142665863,""sadness"":0.4076399505138397,""surprise"":0.1178494393825531,""fear"":0.027798758819699287}"
"আমাদের এখান থেকে কিছু বাংপাকি নিয়ে তোমার দলবারী করো","","weaklyNegative",-0.5987183332443238,"{""neutral"":0.0013167953584343195,""happy"":0.0014650995144620538,""anger/disgust"":0.992610514163971,""sadness"":0.016072237864136696,""surprise"":0.0008087345631793141,""fear"":0.0005506601883098483}"
"আমাদের দেশ থেকে গুজব সৃষ্টিকারি আর মিথ্যারট কারি আর ফেক আইডি খুলে ধর্ম অন্য ধর্মকে লোককে মিথ্যা ফাঁসায় তারা যাবে আর পাকিস্তানের প্রধান মন্ত্রীকে ৫ বছর পূর্ণ করতে সহয়তা করবে","","stronglyNegative",-0.9999374866485595,"{""neutral"":0.0027460220735520124,""happy"":0.003814827185124159,""anger/disgust"":0.9851726293563843,""sadness"":0.04269728064537048,""surprise"":0.004393719136714935,""fear"":0.005206919740885496}"
"আমাদের দেশে যেটা অসম্ভব","","stronglyNegative",-0.9997595310211181,"{""neutral"":0.006935156416147947,""happy"":0.00033404253190383315,""anger/disgust"":0.26864659786224365,""sadness"":0.405790239572525,""surprise"":0.2631249725818634,""fear"":0.056969378143548965}"
"আমাদের দেশেও রয়েছে মির জাফর কিন্তু বস্তাবনদি","","weaklyNegative",-0.5997326612472533,"{""neutral"":0.002978832460939884,""happy"":0.003196962643414736,""anger/disgust"":0.9472764134407043,""sadness"":0.18982169032096863,""surprise"":0.0038932908792048693,""fear"":0.0023843764793127775}"
"আমাদের দেশের মত অবস্থা! ডাকাত ছিঁছকে চোরকে নিয়ে ব্যস্ত","","stronglyNegative",-0.9999476909637451,"{""neutral"":0.006029354874044657,""happy"":0.002225978998467326,""anger/disgust"":0.8873720169067383,""sadness"":0.32180583477020264,""surprise"":0.006572355050593615,""fear"":0.004854792729020119}"
"আমাদের দেশের রাজাকাররা ও তাদের দোসররা এখনো বুঝতে শিখো পাকিস্তান কখনই ভাল ছিলনা ভবিষ্যতেও ভালো হবে কিনা বলা যায়না। পাকিস্তানকে ভালো না বেসে নিজের জন্মভূমি বাংলাদেশকে ভালোবাসো।","","weaklyNegative",-0.40636994838714596,"{""neutral"":0.002258508000522852,""happy"":0.00289065670222044,""anger/disgust"":0.9787108302116394,""sadness"":0.08878174424171448,""surprise"":0.001483576837927103,""fear"":0.003131968667730689}"
"আমাদের দেশের সরকারের সহযোগিতা প্রয়োজন,,🤣🤣","","weaklyPositive",0.5998641014099122,"{""neutral"":0.9887224435806274,""happy"":0.005887570790946484,""anger/disgust"":0.005086282733827829,""sadness"":0.006951555609703064,""surprise"":0.0030148376245051622,""fear"":0.003689384553581476}"
"আমাদের পাকিস্তান পন্থী ২-৪ টে লোকরে মেনশন দিতে মন চাই, ওরা বাংলাদেশের মতো নষ্ট দেশে থাকে কেন????","","stronglyNegative",-0.9999253034591675,"{""neutral"":0.0013735356042161584,""happy"":0.000653480994515121,""anger/disgust"":0.9889197945594788,""sadness"":0.03505216911435127,""surprise"":0.0029382144566625357,""fear"":0.0011683194898068905}"
"আমাদের মাননীয় প্রধানমন্ত্রী কে নিয়ে কিছু লিখুন, বাংলাদেশের উন্নয়ন নিয়ে লিখুন, বাংলাদেশের লুটপাট নিয়ে লিখুন, তা- না করে আপনারা পরে রয়েছেন ইমরান খাঁন কে নিয়ে।","","stronglyNegative",-0.9998850584030151,"{""neutral"":0.0011472584446892142,""happy"":0.0013301869621500373,""anger/disgust"":0.9911551475524902,""sadness"":0.042198408395051956,""surprise"":0.002949667628854513,""fear"":0.00163075455930084}"
"আমাদের সরকারের কাছ থেকে ট্রেনিং নেওয়া দরকার ছিলো,কিভাবে রাতের ভোট এ জিতা যায়।","","weaklyNegative",-0.5997941017150878,"{""neutral"":0.01051179226487875,""happy"":0.002922356128692627,""anger/disgust"":0.9480867385864258,""sadness"":0.0713762491941452,""surprise"":0.02066909335553646,""fear"":0.009640692733228207}"
"আমাদের হাসিনা আন্টি 10 বছর যাবৎ আছে জোরজবস্তি করে😅 কিন্তু ইমরান খান ভালো লোক ছেড়ে দিছে স্বেচ্ছায়✅","","weaklyNegative",-0.48318767547607416,"{""neutral"":0.030047830194234848,""happy"":0.009952995926141739,""anger/disgust"":0.8179311752319336,""sadness"":0.24968931078910828,""surprise"":0.06409233063459396,""fear"":0.019943751394748688}"
"আমার প্রানের বাংলাদেশ","","stronglyPositive",0.9994024515151978,"{""neutral"":0.03301161900162697,""happy"":0.9722670316696167,""anger/disgust"":0.0019217345397919416,""sadness"":0.0014257547445595264,""surprise"":0.0014181248843669891,""fear"":0.0003091793623752892}"
"আমার মতে,,, ইমরান খান ভালো লোক ছিলেন,,, পাকিস্তান দেশটা ভালো ছিল,,, জানিনা এখন কি হবে!!","","weaklyPositive",0.5975614309310914,"{""neutral"":0.2710613012313843,""happy"":0.515165388584137,""anger/disgust"":0.02043772116303444,""sadness"":0.12429411709308624,""surprise"":0.02723749727010727,""fear"":0.18717600405216217}"
"আমি অত্যন্ত দুঃখিত যে চোর, লুটেরা, ডাকাতকে প্রধানমন্ত্রীর পদ দেওয়া হয়েছে এবং যে দেশের প্রতি অনুগত তাকে সরিয়ে দেওয়া হয়েছে।আমার বলার কিছু নাইরাজনীতিতে প্রথমবারের মতো কোনো নেতাকে নিয়ে ভালো কথা শোনা যাচ্ছে হৃদয়ে।আল্লাহ এই প্রিয় মাতৃভূমিকে বিশ্বাসঘাতক, মুনাফিক, চোর-ডাকাত থেকে মুক্ত করুন এবং যারা আন্তরিক তাদের রক্ষা করুন। আমীন","","weaklyPositive",0.345078456401825,"{""neutral"":0.013683580793440342,""happy"":0.17554202675819397,""anger/disgust"":0.25807246565818787,""sadness"":0.8009858727455139,""surprise"":0.05264455825090408,""fear"":0.2920861542224884}"
"আমি আশাবাদী ছিলাম শেষ খেলা ইমরান খানঁ খেলবেন।","","weaklyPositive",0.599969244003296,"{""neutral"":0.08287965506315231,""happy"":0.9480698108673096,""anger/disgust"":0.004577569663524628,""sadness"":0.004323452245444059,""surprise"":0.007174924947321415,""fear"":0.000940974336117506}"
"আমিও অনেক ক্ষুব্ধ প্রকাশ্যে ৮ জন মুসলিমদের প্রকাশ্যে সেদিনও হত্যা করা হলো।তারা ফোন দিয়ে আত্মীয় স্বজনের কাছে সাহায্য চেয়েছিলো।।আত্মীয়রা পুলিশের দাড়ে দাড়ে ঘুরেছে কেউ সাহায্য করেনি।কেউ ঘটনাস্থলে যায়নি।মুসলিম দেখলেই বিজিবির নোংরা মন্তব্য।বোরকা পড়তে বাধা দেয়া।উগ্রবাদিরা এসে হামলা করা।নামাযের জন্য সামান্য কিছু জায়গা বেধে দেয়া সেখানে সব মুসলিমকে গাধাগাধি করে নামায পড়তে বাধ্য করা লাইন ক্রস করলেই নামাযরত মানুষদের উপর হামলা।মুসলিমদের কোনো বড় সরকারি হোক বা বেসরকারি কোথাও চাকরি না দেয়া।ব্যবসা বানিজ্য কিছু করতে না দেয়া।তারা যারা একটু ভালো কাজ করে তাও ধর্মীয কাজের সুযোগ তো পায়ইনা।তাদের পরিচয গোপন করে নামতে হয়।বিজেবির মুসলিমদের এত কোনঠাসা করার পরেও তাদের সামান্য মৌলিক অধিকারটুকু না দেয়া।নাগরিক আইন সহ সকল আইনে মুসলিমদের প্রতি সহিংসতা।তাদের থেকে কোনো কিছু না কেনার জন্য উৎসাহ দেয়া।প্রকাশ্যে হত্যা।যেসময় বাংলাদেশে সাম্প্রদায়িক ঘটনা ঘটেছে তিনজন মানুষও মরেনি তবে ঠিক সেই সময়েই আসামে ত্রিপুরায় মুসলিমদের গ্রাম জ্বালিয়ে দেয়া হয়েছিলো।পানির জন্য মুসলিমরা হাহাকার করছে।অতিতের গুজরাটসহ কত কত দাঙ্গার নৃশংস হত্যাগুলোর কথা নাই বললাম বাংলাদেশে তিনজন হিন্দুও মরলোনা অথচ ফেসবুকে ইন্ডিয়া হ্যাশট্যাগের বন্যা পত্র পত্রিকায় আন্দোলন কত কি করলো অথ সেই সময় আসামে ৪০ জন শিশু ও ১৫ জন নারী ও ৩৫ জন পুরুষকে আগুন জ্বালিয়ে দাঙ্গা হামলা করে এত অত্যাচার করছিলো তা বিবিসির মতো আন্তর্জাতিক মিডিয়া তুলে ধরলো তবে ভারতের কোথাও সে কথা উল্লেখ করলোনা।একসময় আমি হিন্দুদের ভাই মনে করতাম।একসাথে স্কুলে যাওয়া।পদ্মায় সাতার কাটা। হিন্দু হওয়া সত্তেও ওদের নিয়ে মসজিদে বসে রোযায় ইফতার করা।একসাথে ঈদ করা ওদের হাতে মেহেদি দিয়ে দেয়া।শবে বরাতে ওদের বাড়িতে হালুয়া নিয়ে যাওয়া।কত সুন্দর সেই দিনগুলো ছিলো কল্পনাতেও তো এরকম ও হিন্দু আমি মুসলিম এরকম কিছু ভাবছিলামনা।তবে আজ এদেশের হিন্দুদেরও ভারতের মতো সর্বত্র এরকম নোংরা কমেন্ট। ওদের মধ্যেও এরকম উগ্র মনোভাব।ভারতের ইসকনের মতো বিভিন্ন নোংরা সংগঠনগুলো ধর্মে প্রচারের নামে এদেশেও যখন কৌশলে উগ্র ও হিংসা ঢুকিয়ে দিচ্ছে এবার হিন্দুদের দেখলেই পথে ঘাটে আমার মুখ ছিড়ে নৃশংসভাবে হত্যা করতে ইচ্ছা করে","","stronglyNegative",-0.9996415853500367,"{""neutral"":0.0028327046893537045,""happy"":0.01020265743136406,""anger/disgust"":0.8695434927940369,""sadness"":0.4552259147167206,""surprise"":0.025009099394083023,""fear"":0.15475429594516754}"
"আমিও একটা কিনতে চাইছিলাম!","","weaklyPositive",0.5645167589187623,"{""neutral"":0.9961446523666382,""happy"":0.005769492592662573,""anger/disgust"":0.0005973097868263721,""sadness"":0.0009357950184494257,""surprise"":0.0016167114954441786,""fear"":0.00044388906098902225}"
"আমিন","","weaklyPositive",0.5997727632522584,"{""neutral"":0.4196823835372925,""happy"":0.26361799240112305,""anger/disgust"":0.007929384708404541,""sadness"":0.0854516476392746,""surprise"":0.004042423330247402,""fear"":0.01833154633641243}"
"আমেরিকা এবং পুরো পশ্চিমা সভ্যতার কাছে মাথা নত না করা প্রথম পাকিস্তানি প্রধানমন্ত্রী ইমরান খান।","","stronglyPositive",0.9998820066452028,"{""neutral"":0.9864760041236877,""happy"":0.005928991828113794,""anger/disgust"":0.005129426717758179,""sadness"":0.002197431866079569,""surprise"":0.011189970187842846,""fear"":0.0010221968404948711}"
"আমেরিকা ও ইজরায়েলের আতংকের নাম ইমরান খান ও এরদোয়ান....","","stronglyPositive",0.9744607210159303,"{""neutral"":0.022733652964234352,""happy"":0.009783990681171417,""anger/disgust"":0.09139950573444366,""sadness"":0.044680289924144745,""surprise"":0.03466600179672241,""fear"":0.9615882039070129}"
"আমেরিকাকে কটাক্ষ করে কিছু বললেই পররাষ্ট্র নীতি দূর্বল।","","stronglyNegative",-0.9996880531311035,"{""neutral"":0.004612910095602274,""happy"":0.0014760041376575828,""anger/disgust"":0.9828990697860718,""sadness"":0.03835982829332352,""surprise"":0.0025180852971971035,""fear"":0.0012333239428699017}"
