"paragraph","message","polarity_class","polarity_score","emotion"
"এই নিয়েছে ওই নিলো যাটিপ নিয়েছে চিলে 🥴🥴চিলের পিছে ঘুরছি মিছেআমরা সবাই মিলে..","","stronglyNegative",-0.9998002052307129,"{""neutral"":0.022165069356560707,""happy"":0.007362671662122011,""anger/disgust"":0.5184264779090881,""sadness"":0.5936568975448608,""surprise"":0.017262941226363182,""fear"":0.05089963600039482}"
"এই নোংরামি বন্ধ করেন । পারলে দেশ ও জাতিকে বাঁচানোর চেষ্টা করেন । কে কি করছে কেন করছে সবাই তা ভালো করেই বোঝে । সারা বিশ্ব ধ্বংসের পথে আর এরা আছে টিপ ব্যাবসা নিয়ে ।","","stronglyNegative",-0.9981752634048462,"{""neutral"":0.0008947571623139083,""happy"":0.0018726144917309284,""anger/disgust"":0.9893801212310791,""sadness"":0.08462242037057877,""surprise"":0.0028640804812312126,""fear"":0.00543648237362504}"
"এই পুলিশ কর্মকর্তার প্রত্যাহার অযৌক্তিক।উনি তো নারীর স্বাধীনতা নিয়ে কোন কথা বলেন নি। শুধু প্রতিবাদের ধরণ নিয়ে বলেছেন। এতেই প্রত্যাহার বাক-স্বাধীনতার বিরোধী।","","weaklyNegative",-0.5981540918350219,"{""neutral"":0.002666245447471738,""happy"":0.0038108937442302704,""anger/disgust"":0.8487090468406677,""sadness"":0.5433392524719238,""surprise"":0.010165712796151638,""fear"":0.02087019383907318}"
"এই বয়সে টিপ দিলেও কেউ তাকাবে না। হুদাই টাকা লস।","","stronglyNegative",-0.9998867750167847,"{""neutral"":0.0022602451499551535,""happy"":0.0009096161229535937,""anger/disgust"":0.08347896486520767,""sadness"":0.9463021755218506,""surprise"":0.006634972058236599,""fear"":0.03237656131386757}"
"এই বারোভাতারী কে উত্তর কোরিয়া পাঠানো হোক","","neutral",-0.1999879837036133,"{""neutral"":0.00026131237973459065,""happy"":0.00015161609917413443,""anger/disgust"":0.999538779258728,""sadness"":0.0016440094914287329,""surprise"":0.0005257807206362486,""fear"":0.00005603429235634394}"
"এই বেটা তোর বৌ নাই? তুই মেয়ে মানুষদের সম্পকে বাজে কথা বলিস!!!","","stronglyNegative",-0.9999418258666992,"{""neutral"":0.0004584627749864012,""happy"":0.0001362731563858688,""anger/disgust"":0.9984412789344788,""sadness"":0.0026677052956074476,""surprise"":0.0034496216103434563,""fear"":0.0001095825427910313}"
"এই মহিলা তো সব ই জানে,ওনি ইচ্ছে করলেই ওই পুলিশ সদস্যর নাম, বাপের নাম,ঠিকানা সব বলে দিতে পারে,আশা করি ওনারা দুজন পূর্ব পরিচিত ছিলো এটাও নিউজ এ আসবে,,","","weaklyNegative",-0.5850871324539184,"{""neutral"":0.20369014143943787,""happy"":0.1499234139919281,""anger/disgust"":0.39903977513313293,""sadness"":0.13104408979415894,""surprise"":0.22738605737686157,""fear"":0.06474315375089645}"
"এই মহিলার দোষ আছে নাইলে পুলিশ এনার টিপ নিয়ে কথা বলতো না","","stronglyNegative",-0.9994894742965699,"{""neutral"":0.005578526295721531,""happy"":0.0005241087637841702,""anger/disgust"":0.9692392945289612,""sadness"":0.03647138923406601,""surprise"":0.0020843648817390203,""fear"":0.0023352226708084345}"
"এই সব খান'কিদের চেহারা দেখলেও বিরক্ত লাগে😠, আর তাদের কে ⛽ লাগানো জন্য আরো হাজারো খান'কির এখানে অভাব নাই😡","","stronglyNegative",-0.9998629093170166,"{""neutral"":0.00034281250555068254,""happy"":0.0004563587426673621,""anger/disgust"":0.9980108141899109,""sadness"":0.009317153133451939,""surprise"":0.0008294923463836312,""fear"":0.00031742858118377626}"
"এই সিনেমা আর কত দিন চলবে?? নতুন সিনেমার অপেক্ষায় আছি 🙂","","weaklyPositive",0.5998065948486329,"{""neutral"":0.4680311381816864,""happy"":0.5140817165374756,""anger/disgust"":0.04054250940680504,""sadness"":0.025358043611049652,""surprise"":0.009871495887637138,""fear"":0.005026035942137241}"
"এই হলো দেশের শিক্ষা গুরু, মানুষ নামের কলংক","","stronglyNegative",-0.9999362468719483,"{""neutral"":0.0002123652957379818,""happy"":0.0003048588114324957,""anger/disgust"":0.9986501336097717,""sadness"":0.006300401873886585,""surprise"":0.00021923103486187756,""fear"":0.00005830694499309175}"
"এইটা আসলেই সত্য ঘটনা কি না সেটাও ভাবার বিষয়। কারণ একটা মানুষ কেনো অকারণে একজন মহিলাকে এমন আচরণ করবে। হয় ওই লোকের সাথে পূর্বের কোনো শত্রুতা ছিলো, নয়তো ওই লোক পাগল, আর নয়তো এসব মিথ্যা সাজানো ঘটনা। মহিলার কথায় যেহেতু লোকের গায়ে পুলিশের পোশাক ছিলো বলছে তাহলে বিষয়টা আরও বেশি সন্দেহমূলক। পুলিশ কখনো এমন আচরণ করবে না।","","stronglyNegative",-0.9994683742523194,"{""neutral"":0.014223194681107998,""happy"":0.013838037848472595,""anger/disgust"":0.7999970316886902,""sadness"":0.24483127892017365,""surprise"":0.042843759059906006,""fear"":0.3837883472442627}"
"এইসব অতি রঞ্জিত।দুঃখজনক ঘটনা","","stronglyNegative",-0.9998130321502685,"{""neutral"":0.00027330676675774157,""happy"":0.0001987401774385944,""anger/disgust"":0.039266154170036316,""sadness"":0.9956386685371399,""surprise"":0.0005786975962109864,""fear"":0.0016596625791862607}"
"এক খবর কয়বার দিবি খান......... পোলারা।","","stronglyNegative",-0.9997681140899658,"{""neutral"":0.00016256659000646323,""happy"":0.00019506872922647744,""anger/disgust"":0.9995853304862976,""sadness"":0.0011218084255233407,""surprise"":0.0009718969813548028,""fear"":0.000021985104467603378}"
"এক জন নর্তকী সে নিজেই জানে না তার কত হাজার বিয়ে হয়েছে ঠিক তেমনি সে জানেনা কোন ধর্মের জন্ম হয়েছে","","weaklyNegative",-0.5237819433212281,"{""neutral"":0.41931742429733276,""happy"":0.00496651278808713,""anger/disgust"":0.04219943657517433,""sadness"":0.3212653398513794,""surprise"":0.22556613385677338,""fear"":0.013895582407712936}"
"এক জনের ও বুকে/মাথায় ওরনা নাই, হায়,,,,,,,,,,,দুনিয়া","","stronglyNegative",-0.9998231172561646,"{""neutral"":0.0025767928455024958,""happy"":0.0007425379590131342,""anger/disgust"":0.017152398824691772,""sadness"":0.9812102913856506,""surprise"":0.004722410812973976,""fear"":0.008917838335037231}"
"এক টিপ নিয়ে প্রথম আলো যতগুলো নিউজ করেছে। আমি কনফার্ম দেশে একটি পরমাণু হামলা হলেও প্রথম আলো অতগুলো নিউজ করত না।।","","stronglyNegative",-0.9998870134353638,"{""neutral"":0.006370304152369499,""happy"":0.004212190397083759,""anger/disgust"":0.930359423160553,""sadness"":0.08936821669340134,""surprise"":0.01519932970404625,""fear"":0.07442329823970795}"
"এক টিপের আড়ালে হারিয়ে গেছে কত ইসু, এ জাতি পারেও বটে","","stronglyNegative",-0.9998061656951904,"{""neutral"":0.05068536475300789,""happy"":0.040048256516456604,""anger/disgust"":0.04666226729750633,""sadness"":0.8023121356964111,""surprise"":0.2534233033657074,""fear"":0.04767662286758423}"
"এক টিপের জন্য সোশ্যাল মিডিয়া গুলোতে হাজারও সব গণ্যমান্য ব্যাক্তিরা টনক নেড়ে বসছেন।তো বলি হিজাবের বেলাই আপনারা কোথায় থাকেন। কোথায় থাকে আপনাদের প্রতিবাদ মুলক বক্তব্য গুলো।তখন কেন একটু নেড়ে চেড়ে বসেন না।","","weaklyNegative",-0.5997763395309448,"{""neutral"":0.0018896618857979774,""happy"":0.0042292270809412,""anger/disgust"":0.9493136405944824,""sadness"":0.1556490957736969,""surprise"":0.01397103350609541,""fear"":0.025204883888363838}"
"একজন ক্লান্তিহীন অসহায় পুলিশ কনস্টেবল নাজমুল সাহেবের পাশে দাঁড়ান,আপনিও কথা বলুন!একজন ক্লান্তিহীন অসহায় পুলিশ কনস্টেবল নাজমুলের গর্ভবতি স্ত্রী ডাক্তার দেখিয়ে স্বামীর দিকে আসছিলেন। হন্তোদন্ত ছুটে টিপপরা ওই মহিলা গর্ভবতি মহিলার পায়ে পাড়া দেন । নাজমুল সাহেবের স্ত্রী ব্যাথায় চিৎকার দিয়ে ওঠেন। টিপপরা মহিলা নাজমুল সাহেবের স্ত্রীকে লক্ষ্য করে বলেন ""বোরকা একটা পরে হাটে, পাশের দিকে দেখেনা"" নাজমুল সাহেব "" অনেক কথার মধ্যে ও "" টিপ পড়ছিস কেন? আসলেই তো! নাজমুল সাহেবের স্ত্রীর বোরকা পরলে যদি সমস্যা হয় তাহলে তুই বেটি টিপ পরেছিস কেন? পরবি পর, আরেকজনের বোরকাকে তাচ্ছিল্য করার অধিকার তোকে কে দিয়েছে? হাঁটার সময় চোখ কোথায় থাকে? সবাই সরব হলো। সংসদে টিপপন্থী সাংসদও টিপের ফজিলত নিয়ে আলোচনা করলেন। বিচারপতি মানিক পুলিশ বাহিনী থেকে ধর্মান্ধদের উৎখাতের দাবিতে কলাম লিখেলেন। বাদ থাকলেন না আমাদের প্রিয় শিক্ষামন্ত্রীও। তিনিও টিপ পরে ছবি দিলেন। কিন্তু এই তো কয়েকদিন আগে ইসলামী বিশ্ববিদ্যালয়ের এক শিক্ষক ছাত্রীকে নিকাব খুলতে বলেছিল। তখন কিন্তু তিনি নেকাব পরে ওই মেয়ের পক্ষে দাঁড়াননি।এদেশের সাহসী কলম সৈনিক ভাইদের প্রতি অনুরোধ, নাজমুল সাহেবের স্ত্রীর সাক্ষাতকার নিন! ঘটনার সিসিটিভি ফুটেজ বের করুন! যদি দেখা যায় কটূক্তির শুরুটা ওই অভদ্র মহিলাই করেছে, বোরকাকে তাচ্ছিল্য করেছে তাহলে কি বিচারপতি মানিকরা বোরকার পক্ষে কলাম লিখবেন?? কোনো নারী এমপি কি বোরকার পক্ষে সংসদের কথা বলবেন? গর্ভবতী ওই বোরকাপরা মায়ের সঙ্গে সংহতি প্রকাশ করতে আমাদের শিক্ষামন্ত্রীও কি এখন বোরকা পরবেন? রোজার দিনে একজন গাড়িওয়ালা পুলিশ কনস্টেবলকে এভাবে হেনস্তা করা আমরা কোনো ভাবেই মেনে নিতে পারি না। সুষ্টু তদন্ত হোক! নাজমুল সাহেবের স্ত্রীকে আইনের আশ্রয় নেবার অনুরোধ করছি। আইনজীবীরা তার পাশে দাঁড়াবার অনুরোধ করছি। পুলিশ কনস্টেবলের মুখে দাড়ি দেখে হয়তো টিপওয়ালির সাহসটা বেড়েই গিয়েছিল। ভেবেছিল, তাকে ঘায়েল করা সহজ হবে। টিপের কাছে দাড়ি-টুপি ও হিজার অপমানিত। রোজার দিনে টিপের কাছে দাড়ি-টুপি আর বোরকার অবমাননা আমরা সহ্য করতে পারছি না।","","stronglyNegative",-0.9967315912246704,"{""neutral"":0.003177507547661662,""happy"":0.010771425440907478,""anger/disgust"":0.946536123752594,""sadness"":0.17334391176700592,""surprise"":0.024165917187929153,""fear"":0.048776593059301376}"
"একজন দাঁড়ি টুপিওয়ালা পুলিশ কনস্টেবল যখন টিপ পরা নিয়ে একজন সংখ্যালঘু মহিলাকে হেনস্তা করেছিলেন তখন তথাকথিত সুশীল সমাজ থেকে শুরু করে সমগ্র মিডিয়া এমনকি সংসদে পর্যন্ত এর চর্চা হয় কিন্তু আজ যখন টিপওয়ালি হিন্দু মহিলা মুসলমানদের ধর্মীয় ফরজ বিধান হিজাব পরার জন্য বিশজন শিক্ষার্থীকে শারীরিক নির্যাতন করল তখন তাদের চেতনার দণ্ড দাড়ায়নি।হায়রে সুশীল! হায়রে বিবেক!!😡😠🤬","","stronglyNegative",-0.9997228145599365,"{""neutral"":0.003444885602220893,""happy"":0.0056854491122066975,""anger/disgust"":0.8340783715248108,""sadness"":0.45616456866264343,""surprise"":0.030964555218815804,""fear"":0.11278192698955536}"
"একজন দেশের নাগরিক হিসেবে উনি একটা বিতর্কিত কর্মকান্ডে স্বাধীনভাবে নিজের মতামত বা ব্যাখা মুলক কথা বলতেই পারেন। এর জন্য ওনাকেও প্রত্যাহার করতে হবে কেন ? এটাই কি দেশের স্বাধীন মত প্রকাশের স্বাধীনতা...!!!!!!!!!?.","","weaklyNegative",-0.599387812614441,"{""neutral"":0.011517814360558987,""happy"":0.013043439947068691,""anger/disgust"":0.7687626481056213,""sadness"":0.4665161669254303,""surprise"":0.04510006308555603,""fear"":0.025909537449479103}"
"একজন পুলিশ দেশের সবার জন্য সমান এইটা তার দায়িত্ব। সব ধর্মের লোক তার কাছে নিরাপদ হবে এটাই দায়িত্ব।। কাউকে কটাক্ষ করা অন্যায়।","","weaklyPositive",0.5531222105026246,"{""neutral"":0.4483851492404938,""happy"":0.34808793663978577,""anger/disgust"":0.1556120216846466,""sadness"":0.14583894610404968,""surprise"":0.012625406496226788,""fear"":0.02709141932427883}"
"একজন পুলিশের সামনে একজন টিপপর ভদ্রমহিলা হেটে যাচ্ছিল আর পুলিশ তাকে কোনো কারন ছাড়াই -""টিপ পরছিস কেন"" বললো বিষয়টা অযৌক্তিক না।�","","weaklyNegative",-0.5994679450988769,"{""neutral"":0.14602965116500854,""happy"":0.004985000938177109,""anger/disgust"":0.5861785411834717,""sadness"":0.182347372174263,""surprise"":0.1543574184179306,""fear"":0.07498593628406525}"
"একজন পুলিশের সামনে একজন টিপপরা ভদ্রমহিলা হেটে যাচ্ছিল আর পুলিশ তাকে কোনো কারন ছাড়াই -""টিপ পরছিস কেন"" বললো বিষয়টা অযৌক্তিক না।�","","weaklyNegative",-0.5996623039245605,"{""neutral"":0.08069194853305817,""happy"":0.0042158858850598335,""anger/disgust"":0.6881088018417358,""sadness"":0.1934637725353241,""surprise"":0.13003583252429962,""fear"":0.06798708438873291}"
"একজন মহিলা কি পড়বে সেটা তার ব্যক্তিগত বিষয় সেটা নিয়ে মন্তব্য করার পক্ষপাত আমি নই।তবে আমি শঙ্কিত যে হারে টিপ মেয়ে মানুষ মাতামাতি শুরু করেছে কখন যে বাংলাদেশের দুই নেত্রী টিপ পরে জনগণকে কাছে টানার চেষ্টা করে।","","weaklyNegative",-0.5998218297958373,"{""neutral"":0.006475378759205341,""happy"":0.013331342488527298,""anger/disgust"":0.20065724849700928,""sadness"":0.1069502979516983,""surprise"":0.018548203632235527,""fear"":0.9569215774536133}"
"একজনকে বিয়ে করে আরেকজনের বিছানার সঙ্গী হয় সেইও আবার সংসদে কথা বলে টিব নিয়ে","","weaklyNegative",-0.5998852014541626,"{""neutral"":0.01391742192208767,""happy"":0.0012237458722665906,""anger/disgust"":0.8909492492675781,""sadness"":0.046526022255420685,""surprise"":0.32356375455856323,""fear"":0.008633226156234741}"
"একদম ঠিক আর পাপও কিন্তু আপনার 😊","","weaklyPositive",0.5582195520401002,"{""neutral"":0.022413061931729317,""happy"":0.8803344368934631,""anger/disgust"":0.15360882878303528,""sadness"":0.005719584878534079,""surprise"":0.016489258036017418,""fear"":0.0007924564415588975}"
"একদম বিনা কারনে এই কথা কেউ বলতে পারে। যুগ যুগ ধরে টিপ পরছে মহিলারা কই এতদিন তোন কথা হয়নি। হঠাৎ একজন পুলিশ সদস্য বিনা কারনে কেন বলবেন। আর এটা জাতীয় ইস্যু কেন হবে।","","stronglyNegative",-0.8798076629638671,"{""neutral"":0.006856237538158894,""happy"":0.0049326978623867035,""anger/disgust"":0.9080541729927063,""sadness"":0.16655634343624115,""surprise"":0.05767151713371277,""fear"":0.062904953956604}"
"একমাত্র বদলী যদি শাস্তি হয তাহলেতো রাস্তায় বের হলে তো ঐসব দুষ্ট লোকেরা তো টিপা টিপি আর কত কিছুই করে বসবে সেই সুযোগ করে দিল।।। জনগন তো অবাক।।","","stronglyNegative",-0.9992181777954101,"{""neutral"":0.007371667772531509,""happy"":0.004832176957279444,""anger/disgust"":0.42816591262817383,""sadness"":0.34146493673324585,""surprise"":0.47108909487724304,""fear"":0.1287156194448471}"
"একাত্তরের চেতনার সাথে টিপের কি সম্পর্ক?","","neutral",-0.19998719692230227,"{""neutral"":0.06482427567243576,""happy"":0.0033255445305258036,""anger/disgust"":0.9243389368057251,""sadness"":0.04811356961727142,""surprise"":0.028097711503505707,""fear"":0.008791038766503334}"
"এখন এটা নারীর স্বাধীনতা, ঠিকাছে মানলাম।হিজাব,বোরকা কি তবে? নারীর অধিকার নয়?","","weaklyNegative",-0.57505304813385,"{""neutral"":0.1423841118812561,""happy"":0.014580166898667812,""anger/disgust"":0.6585269570350647,""sadness"":0.1949189454317093,""surprise"":0.15338212251663208,""fear"":0.047234032303094864}"
"এখন দেখি শিক্ষিতরাও চামচামি করে","","weaklyNegative",-0.59891836643219,"{""neutral"":0.0025793223176151514,""happy"":0.0007884293445385993,""anger/disgust"":0.9614092111587524,""sadness"":0.12122759222984314,""surprise"":0.007779501844197512,""fear"":0.004382728133350611}"
"এখন বসে বসে তার ছেরো","","neutral",-0.1964006543159485,"{""neutral"":0.0014980763662606478,""happy"":0.000277978484518826,""anger/disgust"":0.9961910247802734,""sadness"":0.004187231417745352,""surprise"":0.0005458918167278171,""fear"":0.00004080840517417528}"
"এখন হিজাব নিয়ে কথা বলছেন শিক্ষকা তার বিচার কি হবে","","weaklyNegative",-0.5997579097747803,"{""neutral"":0.1238522082567215,""happy"":0.006217943970113993,""anger/disgust"":0.4769761860370636,""sadness"":0.2791571021080017,""surprise"":0.03814265877008438,""fear"":0.24859265983104706}"
"এখন হিজাবের টা তদন্ত করা হোক।","","weaklyNegative",-0.5995458126068115,"{""neutral"":0.7575811743736267,""happy"":0.006791459396481514,""anger/disgust"":0.3991527259349823,""sadness"":0.02378952130675316,""surprise"":0.008948558941483498,""fear"":0.0041442615911364555}"
"এতদিন দায়িত্বের কথা উঠে নাই কেন?","","weaklyNegative",-0.5998214483261108,"{""neutral"":0.047209277749061584,""happy"":0.002185260411351919,""anger/disgust"":0.8166716694831848,""sadness"":0.1068011224269867,""surprise"":0.1989661157131195,""fear"":0.011715502478182316}"
"এতদিন পর বুঝলাম নারীবাদীরা কেন এত বড় টিপ পড়ত 😎","","stronglyNegative",-0.9992645025253296,"{""neutral"":0.06994283944368362,""happy"":0.015630194917321205,""anger/disgust"":0.7861593961715698,""sadness"":0.11848696321249008,""surprise"":0.048796314746141434,""fear"":0.003551725996658206}"
"এতদিন মাথায় টুপি দিলে মুখে দাঁড়ি রাখলে যে পুলিশ অনেক মানুষ করে জংগি মৌলবাদী বলে অনেক মানুষ কে হেনেস্তা করেছে তখন এই মেডাম কোথায় ছিলেন? আজকে টিপ পরিধান করা মহিলার জন্য এত প্রতিবাদী হয়ে গেলেন।","","stronglyNegative",-0.9998526573181152,"{""neutral"":0.006288009695708752,""happy"":0.008158895187079906,""anger/disgust"":0.9342499375343323,""sadness"":0.10966917127370834,""surprise"":0.040937162935733795,""fear"":0.027189020067453384}"
"এতে মায়া কান্না এখন চুতিয়া মিডিয়া আর যখন হিজাব বোরকা নিয়ে বলে তখন মিডিয়া বাল ছাড়ে","","stronglyNegative",-0.9999370574951172,"{""neutral"":0.00031100877095013857,""happy"":0.00036619676393456757,""anger/disgust"":0.9986749291419983,""sadness"":0.005347758531570435,""surprise"":0.0009068910148926079,""fear"":0.00007773911784170195}"
