"paragraph","message","polarity_class","polarity_score","emotion"
"টিপ পরা নিয়ে অনেকদিন থেকেই কিচ্ছা কাহিনী প্রচার করা হচ্ছে। কিছু গণমাধ্যমেও দেখলাম টিপ পরার ইতিহাস প্রকাশ করেছে। দৈনিক ইনকিলাব লিখেছে, ""আলেমগণ বলেন, মুসলিম নারীর কপালে টিপ পরা হারাম।""আরও বলা হয়েছেঃ ইব্রাহিম আঃ কে অগ্নিকুণ্ডে নিক্ষেপের জন্য চড়কে তোলা হলে ফেরেশতাগণ তার উপরে চড়ে বসে। চড়ক ঘোরাতে না পেরে ইবলিসের পরামর্শে নমরুদ নগ্ন প তি তা দের চড়কের কাছে এনে জড়ো করে। এতে ফেরেস্তারা লজ্জা পেয়ে চলে যায়।এ ঘটনার সঙ্গে যুক্ত করা হয়েছে ""প তি তারা টিপ পরেছিল।""ফেরেস্তা সম্পর্কে ইসলামী আকিদাঃ ফেরেস্তারা আল্লাহ যা বলেন তা অক্ষরে অক্ষরে পালন করে। নিজ ইচ্ছায় কিছুই করে না বলে পাপ পূণ্য কিছুই তাদের ক্ষেত্রে বিবেচ্য নয়।এ আকিদায় বিশ্বাস না করলে তা কুফরী হিসেবে বিবেচিত হবে। অথচ কথিত তাফসিরে বলা হয়েছে - নগ্ন নারীদের দেখে লজ্জা পেয়ে ফেরেস্তারা ইব্রাহিম আঃকে সুরক্ষা করতে আল্লাহর দেয়া নির্দেশ অমান্য করেছে।একদল এই বানোয়াট কাহিনী রচনা করেছে, আরেক দল টিপকে যুক্ত করে কাহিনীর পরিবর্ধন করেছে।অথচ কল্পকাহিনী দিয়ে হারাম নির্ধারণের মতো ঔদ্ধত্য দেখানো হয়েছে। ইসলাম সম্পর্কে প্রয়োজনীয় জ্ঞান থাকলে এটা করার কথা নয়।অর্ধশিক্ষিত ও অশিক্ষিত কিন্তু জনপ্রিয় ওয়াজিরা (কাসাস) গত ১৫শ বছর ধরে বানোয়াট কিচ্ছা কাহিনী বলে মানুষের মনোরঞ্জন করে আসছে। জনপ্রিয় কাসাসদের উস্কানিতে অনুভূতিপ্রবণ মুসলিমরা ইমাম আহমেদকে প্রহার করে রক্তাক্ত করেছিল। তাই ওয়াজীদের মুখে মুখে ফেরা বহু কাহিনী কোরআনের তাফসিরেও স্থান পেয়েছে।কোরআনে আল্লাহকে ভয় করতে বলা হয়েছে, নবীদের সম্মান করতে বলা হয়েছে। আল্লাহ ও নবীগণ যা বলেন নি তা বলা কঠোরভাবে নিষিদ্ধ করা হয়েছে। কিন্তু মোল্লারা এমনভাবে ওয়াজ করে যেন শ্রোতাদের কাছে শ্যালক-শ্যালিকাদের গল্প শোনানো হচ্ছে। ""আল্লাহ নবীকে বললো এই..."", ""আল্লাহ বললেন ঐ..."" - উল্লেখ করে যত ঘটনা বর্ণনা করা হয় তার প্রায় সবই মনগড়া। আল্লাহ ও নবী রাসুল নিয়ে অনবরত মিথ্যা বলতে তাদের বিবেকে এতটুকু বাধে না। অনেক ওয়াজি নিজের/দলের স্বার্থ রক্ষায় মনমতো কোরআনের আয়াত বর্ণনা করে। অনেকে আয়াত বলে একটা, বর্ণনায় বলে অন্য কথা। এসবের ফলাফল যে নিশ্চিত জাহান্নাম তা জেনেও না জানার ভান করে সম্ভবত। মোল্লাদের অনেকে নাস্তিক কিনা আমার প্রায়ই সন্দেহ হয়!হারাম ও হালাল নির্ধারণের সম্পূর্ণ এখতিয়ার আল্লাহর। জায়েজ/হালালের তালিকা করা সম্ভব নয়। তাই সাধারণ রীতি হচ্ছে যা হারাম তার বাইরে সবই হালাল। টিপ নাজায়েজ হওয়ার প্রশ্নই আসে না। ধর্মজীবীদের দ্বারা হারামকে হালাল ও হালালকে হারাম করাকে ইসলামে শিরক বলা হয়েছে। তাই মুর্খদের অনুসরণ করা শিরকের পর্যায়ে পড়বে।হয়তো বলা হবে অন্য ধর্মের কিছু গ্রহণ করা যাবে না। হিন্দুরা জন্মদাতাকে বাবা ডাকে, আপনি তাহলে বাবাকে দুলাভাই ডাকেন।স্থানীয় সংস্কৃতি গ্রহণের সঙ্গে মোল্লাদের বিরোধ থাকতে পারে, ইসলামের কোনো বিরোধ‌ নেই।-- আবদুল্লাহ হারুন জুয়েল.","","stronglyNegative",-0.9712849140167237,"{""neutral"":0.0201739389449358,""happy"":0.049243565648794174,""anger/disgust"":0.7372885942459106,""sadness"":0.39169931411743164,""surprise"":0.11822168529033661,""fear"":0.2862533628940582}"
"টিপ পরা ভালো না, এটা হিন্দুদের বিশ্বাস... একজন মুসলীম মেয়ে হয়ে আমি টিপ পড়া ঘৃনা করি...","","stronglyNegative",-0.9997720956802368,"{""neutral"":0.00289911893196404,""happy"":0.0012554150307551026,""anger/disgust"":0.7025920152664185,""sadness"":0.5314328670501709,""surprise"":0.0046262675896286964,""fear"":0.03916338086128235}"
"টিপ পরা মুসলমান মেয়েদের জন্য হারাম","","weaklyNegative",-0.5929120779037476,"{""neutral"":0.2136012315750122,""happy"":0.0002133042726200074,""anger/disgust"":0.06271307170391083,""sadness"":0.4900321662425995,""surprise"":0.010631585493683815,""fear"":0.0400741845369339}"
"টিপ পরার ইস্যুটা খুবই বিছিন্ন একটা ঘটনা। এমন না যে এই দেশে টিপ পরে বের হলে সবাই তাকে টিজ করে। ঢাকা শহরে উড়না ছাড়া ঘুরলেও কেউ কোন টিজ করে না। পাতলা টাইট জিন্স, টি শার্ট পরে হাজার হাজার মেয়ে ঘুরছে এই শহরে। কেউ কিছু বলছে না। কেউ হা করে তাকিয়েও থাকছে না। এই শহরে সবাই দৌড়ের উপরে থাকে। রাস্তায় কে কি ড্রেস পড়ে যাচ্ছে না যাচ্ছে এগুলো নিয়ে মাথাঘামানোর সময় নেই কারো। এগুলো খুব স্বাভাবিক হয়ে গেছে এখানে। এখন কোন একজন মানসিক বিকারগস্ত লোক কাকে টিপ পরা নিয়ে রাস্তায় কি বলেছে এটাকে একেবারে রাষ্ট্রিয় গুরুত্বপূর্ণ ইস্যু বানানো হয়তো উদ্দেশ্যপ্রণোদিত। চারিদিকে একটা অস্থিরতা চলছে এখন। সুযোগ পেলেই এক বিষয় থেকে আরেক আরেক বিষয়ে নজড় সরানোর চেষ্টাও চলে এখানে। আর এসব ফালতু বিষয়গুলো দিয়ে খুব সহজেই মানুষের দৃষ্টি আকর্ষন করা যায়। এক পক্ষ সাফাই গাইবে, আরেক পক্ষ বিরুদ্ধে বলবে। ব্যাস! কয়েকদিন এসব আলতু ফালতু প্যাচাল চলবে ফেসবুকে। মানুষ ভুলে যাবে অনেক কিছুই। আর এসব ফাউ বিষয় জনগনের মাথায় ঢুকিয়ে রঙ টঙ্গ দিয়ে একটা মারাত্মক ইস্যু বানিয়ে সংসদে বক্তৃতা দেয়ার মতো কিছু হয় নাই। যত্তসব","","stronglyNegative",-0.9992512941360474,"{""neutral"":0.0030008016619831324,""happy"":0.008671348914504051,""anger/disgust"":0.9372379779815674,""sadness"":0.23869681358337402,""surprise"":0.02751823514699936,""fear"":0.04458089917898178}"
"টিপ পরার কারণে পায়ের উপর দিয়ে বাইক নিয়া যায় পুলিশ, তারপরও নাকি এরাই আবার শান্তিবাহিনীর লোক! তারপরও নাকি এরা সাম্প্রদায়িক না। তারপরও নাকি এরা উগ্র না! উফ, কুল!","","stronglyNegative",-0.9998687267303467,"{""neutral"":0.0783957988023758,""happy"":0.02216964401304722,""anger/disgust"":0.6534963846206665,""sadness"":0.23626436293125153,""surprise"":0.22299671173095703,""fear"":0.17102347314357758}"
"টিপ পরার সত্যতা নিয়ে অভিযোগ করার আগে হিজাব পরায় নওগায় 18 শিক্ষার্থীকে পেটালেন হিন্দু শিক্ষক তার বিচার আগে করুন 😡😡😡😡","","stronglyNegative",-0.9999026536941529,"{""neutral"":0.009310918860137463,""happy"":0.0026587091851979494,""anger/disgust"":0.9473698139190674,""sadness"":0.11097632348537445,""surprise"":0.022027108818292618,""fear"":0.025084324181079865}"
"টিপ পরিহিত মানুষ গুলো বাংলাদেশের প্রথম সারির নাগরিক","","stronglyPositive",0.9993330240249635,"{""neutral"":0.5407943725585938,""happy"":0.16227085888385773,""anger/disgust"":0.011965285986661911,""sadness"":0.0003984439535997808,""surprise"":0.032403506338596344,""fear"":0.00019199616508558393}"
"টিপ পরে নর্তকী রা","","neutral",-0.1997744917869568,"{""neutral"":0.9983616471290588,""happy"":0.00015491647354792804,""anger/disgust"":0.00047241628635674715,""sadness"":0.00010581249807728454,""surprise"":0.0014863506658002734,""fear"":0.00019629960297606885}"
"টিপ পরে পতিতারা","","weaklyNegative",-0.5968072175979614,"{""neutral"":0.0068224393762648106,""happy"":0.0002561280271038413,""anger/disgust"":0.9919581413269043,""sadness"":0.0025462990161031485,""surprise"":0.0034809999633580446,""fear"":0.00043880747398361564}"
"টিপ বলে একাত্তরের চেতনা??!! আজকে নতুন দেখলাম। এইসব বুদ্ধিপ্রতিবন্ধীদের উদয় যে কই থাকে হয় কে জানে??এইসব বুদ্ধিপ্রতিবন্ধীরা তখন নিশ্চুপ ছিলো যখন এদেশে বোরকা, হিজাব পরা নিয়ে অনেককেই অনেকভাবে হয়রানি হতে হয়।এদের আসলে মূল সমস্যা হলো ইসলামকে নিয়ে।এইসব ইসলাম বিদ্ষেষীও একদিন ইন শা আল্লাহ নির্মূল হবেই কিন্তু ইসলাম এদেশে রয়ে যাবে চিরকাল ইন শা আল্লাহ। বাংলাদেশ যতদিন থাকবে এদেশে ইসলাম ও ততদিন থাকবে।","","neutral",-0.13873896598815919,"{""neutral"":0.01973680965602398,""happy"":0.36127594113349915,""anger/disgust"":0.6635723114013672,""sadness"":0.46391183137893677,""surprise"":0.05622592195868492,""fear"":0.07304718345403671}"
"টিপ বাস্তবায়ন সমিতি 🙄","","neutral",0.19989379644393923,"{""neutral"":0.996550440788269,""happy"":0.0007803028565831482,""anger/disgust"":0.004363053012639284,""sadness"":0.0009153171558864415,""surprise"":0.0015975687419995666,""fear"":0.0005183800822123885}"
"টিপ ব্যস্যার প্রতীক,,, মুসলিম টিপ ব্যবহার করা হারাম,হারাম হারাম।।।","","stronglyNegative",-0.9998446702957153,"{""neutral"":0.023488767445087433,""happy"":0.0022654803469777107,""anger/disgust"":0.5540384650230408,""sadness"":0.41568723320961,""surprise"":0.009080857038497925,""fear"":0.07769021391868591}"
"টিপ মারানিদের নিকট পুলিশ ধরাশয়ি।","","stronglyNegative",-0.9999490261077881,"{""neutral"":0.00524285389110446,""happy"":0.0018617272144183517,""anger/disgust"":0.5061016082763672,""sadness"":0.6283078193664551,""surprise"":0.008399654179811478,""fear"":0.0349709652364254}"
"টিপ মুসলমানদের সংস্কৃতি নয়","","weaklyNegative",-0.5798416852951049,"{""neutral"":0.02004634216427803,""happy"":0.00868287030607462,""anger/disgust"":0.6611323952674866,""sadness"":0.5298318266868591,""surprise"":0.03020084835588932,""fear"":0.012336436659097672}"
"টিপ যারা পরে ইব্রাহীম আঃ সালামের আমলে এটাকে বলা হতো পতিতা চরিত্র","","stronglyNegative",-0.9996743440628052,"{""neutral"":0.3863446116447449,""happy"":0.005125012714415789,""anger/disgust"":0.2765429615974426,""sadness"":0.07227706164121628,""surprise"":0.11993589252233505,""fear"":0.07798009365797043}"
"টিপ যোদ্ধা যেকেউ হতেই পারে।টিপ বাঙালি হিন্দুয়ানি সংস্কৃতি এটা বললে ঠিক আছে।কিন্তু ৯০% মুসলিমের জন্য বাঙালি মুসলিম সংস্কৃতিও আলাদা। এটা অবশ্যই মাথায় রাখা উচিত।সংস্কৃতির সৃষ্টি ধর্ম বিশ্বাস থেকেই।","","neutral",0.19493720531463624,"{""neutral"":0.11137879639863968,""happy"":0.12846101820468903,""anger/disgust"":0.6169794201850891,""sadness"":0.34698036313056946,""surprise"":0.03258467838168144,""fear"":0.03371996432542801}"
"টিপ সাংসদ যেখানে বলেছে সেখানে সাধারণ এই পুলিশের বিরুদ্ধে সব তথ্য না পেলেও পাবে এটাই সাভাবিক।","","stronglyNegative",-0.9933197259902954,"{""neutral"":0.21176761388778687,""happy"":0.014677661471068859,""anger/disgust"":0.6460683345794678,""sadness"":0.17672091722488403,""surprise"":0.037463948130607605,""fear"":0.016725488007068634}"
"টিপ হচ্ছে এমন একটি পুরস্কার, যেটি কাফির নমরুদ প্রদান করেছিল, হযরত ইব্রাহীম (আঃ) কে যে অগ্নি কুন্ডে নিক্ষেপ করাহয়েছিল, তার চারপাশে যেনা-ব্যাভিচারকারীদেরকে।৷ আজ সেই টিপের পক্ষে এতো তোলপাড়?","","stronglyNegative",-0.9997533798217774,"{""neutral"":0.019946739077568054,""happy"":0.022126279771327972,""anger/disgust"":0.7654843330383301,""sadness"":0.2313411831855774,""surprise"":0.18535886704921722,""fear"":0.120252825319767}"
"টিপ হচ্ছে নাস্তিক মহিলাদের চেনার সহজ মাধ্যম","","weaklyNegative",-0.5269417047500611,"{""neutral"":0.9716768860816956,""happy"":0.023579008877277374,""anger/disgust"":0.005358012858778238,""sadness"":0.0013474378501996398,""surprise"":0.0062315864488482475,""fear"":0.0006854821695014834}"
"টিপ হচ্ছে পতিতা নারীদের চেনার একমাত্র চিহ্ন। তাই সেই পতিতাদের যদি কেউ তাদের পেশা নিয়ে / পেশার চিহ্ন নিয়ে প্রশ্ন করে তাহলে পতিতাদের খারাপ তো লাগবেই। যাই হোক ভাই পতিতাদের পতিতার মতই বাচতে দিন,,,, ওরা সম্মানের মাহাত্ম্য বুঝে না। ওরা পতিতা বেশেই থাকতে সাচ্ছন্দ্য বোধ করে।🤮🤮","","stronglyNegative",-0.9996651649475098,"{""neutral"":0.011487690731883049,""happy"":0.015663640573620796,""anger/disgust"":0.12702983617782593,""sadness"":0.9472936391830444,""surprise"":0.015254824422299862,""fear"":0.0596393384039402}"
"টিপ হলো পতিতা চিহ্ন","","stronglyNegative",-0.9988661527633667,"{""neutral"":0.09000147134065628,""happy"":0.0024871944915503263,""anger/disgust"":0.8345239162445068,""sadness"":0.05429280176758766,""surprise"":0.02981211431324482,""fear"":0.033018335700035095}"
"টিপ হলো পতিতার প্রতিক","","stronglyNegative",-0.9996713876724244,"{""neutral"":0.013967671431601048,""happy"":0.0027755573391914368,""anger/disgust"":0.9595638513565063,""sadness"":0.036964695900678635,""surprise"":0.016377940773963928,""fear"":0.008596650324761868}"
"টিপ হিন্দুরা পরে পরতেই পারে সেটা তাদের ব্যক্তিগত স্বাধীনতা আইন এই ক্ষেত্রে তার নিজের গতিতে চলবে কিন্তু মুসলিম দেশ হয়ে হিজাব বোরখা নিয়ে যদি কেউ বিরুদিতা করে তাহলে তো এই আইন সেখানে কি ভূমিকা পালন করে সামান্য টিপ এর জন্যে যদি এতো বড় শাস্তি দেয় এই পুলিশ ভাই দের কে তাহলে হিজাব বোরকা নিয়ে কেউ বিরুদিতা করলে তার গাড় থেকে মাথা তা নামিয়ে দেওয়া ধরকার মুসলিম দেশর আইন এর","","stronglyNegative",-0.9987815856933594,"{""neutral"":0.010043233633041382,""happy"":0.021594054996967316,""anger/disgust"":0.8695371150970459,""sadness"":0.33916446566581726,""surprise"":0.04034796729683876,""fear"":0.06833039969205856}"
"টিপ হিমাগারে..... এখন বোতল বাহিরে....","","weaklyNegative",-0.5957353591918946,"{""neutral"":0.9769613146781921,""happy"":0.001741573098115623,""anger/disgust"":0.0031226910650730133,""sadness"":0.020020930096507072,""surprise"":0.005559660028666258,""fear"":0.008557727560400963}"
"টিপওয়ালী যে বোরকা পরা নিয়ে কটাক্ষ করল সে বিষয়ে প্রতিবাদে এইসব টিপরামকারীদের মুখ গোবরে আটকে যায়।","","stronglyNegative",-0.9999394893646241,"{""neutral"":0.0007023902726359665,""happy"":0.000617890153080225,""anger/disgust"":0.994989812374115,""sadness"":0.013508261181414127,""surprise"":0.0014685069909319282,""fear"":0.0005416253115981817}"
