"paragraph","message","polarity_class","polarity_score","emotion"
"আমার এলাকায় সরকারের একটা ঘর দিতে ৩০ হাজার টাকা করে নেয়। তাও একমাস তাদের পিছনে গুরতে হয়।","","stronglyNegative",-0.999593997001648,"{""neutral"":0.002531626494601369,""happy"":0.0013306709006428719,""anger/disgust"":0.8075068593025208,""sadness"":0.5296282768249512,""surprise"":0.009238645434379578,""fear"":0.015545646660029888}"
"আমার নিজের বাড়ি নাই, ভাড়া বাসায় থাকি। আমি কি গৃহহীন?","","neutral",-0.17658201456069947,"{""neutral"":0.2757376432418823,""happy"":0.0010178607190027833,""anger/disgust"":0.007713681552559137,""sadness"":0.6143279075622559,""surprise"":0.010587552562355995,""fear"":0.1537930816411972}"
"আমার মনে হয় উনি শীলংকা থেকে আসছেন কারণ আমাদের দেশের কিছু গরু ছাগল দের মন্ত্রীর আছে। তারা তো সবসময়ই বলে বেড়ান এই দেশে নাকি গরীব মানুষ নাই।","","stronglyNegative",-0.9992310047149658,"{""neutral"":0.0006708588916808367,""happy"":0.0005303669604472816,""anger/disgust"":0.9966863989830017,""sadness"":0.012481850571930408,""surprise"":0.0038435151800513268,""fear"":0.000988587038591504}"
"আমার মনে হয় তিনি এই ডিজিটাল দেশের নাগরিক নহে","","weaklyNegative",-0.5991044521331788,"{""neutral"":0.03258268162608147,""happy"":0.0005354532622732222,""anger/disgust"":0.2896416187286377,""sadness"":0.5022749304771423,""surprise"":0.00708008510991931,""fear"":0.04016738012433052}"
"আমার মুখে হাসি নাই কারন খাবার পানি নাই ৫ বছর অথচ ওয়াসা বিল নেয় মাসে মাসে, রাস্তা নাই, সুয়ারেজের লাইন নাই , অথচ দেখার কেউ নাই। কোনা পাড়া, ডগাই, মাজার রোড । Bangladesh","","stronglyNegative",-0.9975892305374146,"{""neutral"":0.006438687909394503,""happy"":0.005626424681395292,""anger/disgust"":0.7307613492012024,""sadness"":0.741456925868988,""surprise"":0.02492973767220974,""fear"":0.05330624803900719}"
"আমারও একটা লাগবে","","neutral",0.19993569850921633,"{""neutral"":0.8602319955825806,""happy"":0.05877002701163292,""anger/disgust"":0.021849283948540688,""sadness"":0.06543856859207153,""surprise"":0.020362626761198044,""fear"":0.01968451403081417}"
"আমি এক জন প্রবাসি আমাকে একটি ঘর দিলে ভালো হতো সেক হাসিনা সরকার বার বার দরকার জয় বাংলা জয় বঙ্গবন্ধু কন্যা প্রধানমন্ত্রী শেখ হাসিনা আমরা চাই সুন্দর সমাজ প্রবাসি","","stronglyPositive",0.9997800111770632,"{""neutral"":0.041414905339479446,""happy"":0.9501377940177917,""anger/disgust"":0.013229107484221458,""sadness"":0.021034326404333115,""surprise"":0.0027298852801322937,""fear"":0.0038851997815072536}"
"আমি বলি টাকাটা কার?","","neutral",-0.19999067783355715,"{""neutral"":0.895423173904419,""happy"":0.01091628149151802,""anger/disgust"":0.14163635671138763,""sadness"":0.020588723942637444,""surprise"":0.03373701870441437,""fear"":0.008881112560629845}"
"আমি বাংলাদেশের সমস্ত মানুষের ভোট হরন করতে খুব ভালোবাসি।","","stronglyNegative",-0.9998623371124268,"{""neutral"":0.00407863175496459,""happy"":0.0978718250989914,""anger/disgust"":0.955551266670227,""sadness"":0.024615347385406494,""surprise"":0.0018897842383012176,""fear"":0.0009536566212773323}"
"আমি শুধু ভাবি একজন মানুষ এত কিছু কিভাবে পাড়ে ।যিনি সারাদিন দেশের উন্নয়নে কাজ করেন এবং রাতে আল্লাহর ইবাদতে মগ্ন থাকেন।আল্লাহ তায়ালা তাকে অমরত্ত দান করুন।","","stronglyPositive",0.8527795553207398,"{""neutral"":0.001955887535586953,""happy"":0.9532558917999268,""anger/disgust"":0.000589357630815357,""sadness"":0.0016346852062270045,""surprise"":0.8695477247238159,""fear"":0.0006944285705685616}"
"আমিও","","neutral",0.18214486837387087,"{""neutral"":0.8256729245185852,""happy"":0.11586438119411469,""anger/disgust"":0.005818808916956186,""sadness"":0.0050768135115504265,""surprise"":0.001319957198575139,""fear"":0.0004986238200217485}"
"আমিও আপনার সব কার্যক্রম পছন্দ করি","","stronglyPositive",0.9987050533294679,"{""neutral"":0.00008777996845310554,""happy"":0.9998551607131958,""anger/disgust"":0.00016963478992693126,""sadness"":0.0004830930265597999,""surprise"":0.00026312441332265735,""fear"":0.000011470954632386565}"
"আয়ুষ্কাল, লিঙ্গ সমতা, সর্বজনীন প্রাথমিক শিক্ষা, নারী শিক্ষা, নারীর রাজনৈতিক অধিকার, নারী ও শিশু মৃত্যুহার, স্যানিটেশন এবং খাদ্যের প্রাপ্যতার মতো বিভিন্ন সূচকে, বাংলাদেশ শুধু প্রতিবেশী দেশগুলোকে ছাড়িয়ে যায়নি, অনেক ক্ষেত্রে উন্নত দেশগুলোকেও ছাড়িয়ে গেছে। ধন্যবাদ মাননীয় প্রধানমন্ত্রী শেখ হাসিনা।","","stronglyPositive",0.9998814821243287,"{""neutral"":0.006627901457250118,""happy"":0.9942113757133484,""anger/disgust"":0.003124255919829011,""sadness"":0.012816930189728737,""surprise"":0.06345882266759872,""fear"":0.004710616543889046}"
"আর আলেম সমাজকে নির্যাতন করে আপনি শান্তি পান।","","stronglyNegative",-0.9999348640441894,"{""neutral"":0.00020485410641413182,""happy"":0.0002575853723101318,""anger/disgust"":0.9993671774864197,""sadness"":0.001951462822034955,""surprise"":0.0010129570728167892,""fear"":0.00007402970368275419}"
"আর এতো মানুষের কান্না তো চশমা দিয়েও চোখে পড়ে না!🙄🥴","","stronglyNegative",-0.9998697757720947,"{""neutral"":0.01468368899077177,""happy"":0.0007371042738668621,""anger/disgust"":0.11089606583118439,""sadness"":0.885668933391571,""surprise"":0.05188462510704994,""fear"":0.014731409959495068}"
"আর কারা নির্যাতিত জিয়ার সৈনিকদের পরিবারের কান্না দেখে আপনি হাসেন ।ঈদের আগে সকল কারাবন্দীর মুক্তি চাই ।","","weaklyPositive",0.5402883529663087,"{""neutral"":0.010544069111347198,""happy"":0.03375039994716644,""anger/disgust"":0.8128640055656433,""sadness"":0.35500290989875793,""surprise"":0.007850096561014652,""fear"":0.010776791721582413}"
"আর কী কী পেলে বাংলার মানুষ আওয়ামীলীগকে ভালবাসবে,আমি এটাই বুঝি না।😑😔","","weaklyNegative",-0.5996357917785644,"{""neutral"":0.005181499756872654,""happy"":0.0006745890132151544,""anger/disgust"":0.9515462517738342,""sadness"":0.09192600846290588,""surprise"":0.01111095305532217,""fear"":0.003786916146054864}"
"আর ঘর ছাড়া পিতৃহারা পরিবার গুলো যাদেরকে গুম, খুন করেছেন তাদের পরিবারের খোজ খবর কখনো নিয়েছেন??","","stronglyNegative",-0.9999454975128174,"{""neutral"":0.0035783296916633844,""happy"":0.0016416445141658187,""anger/disgust"":0.7923694849014282,""sadness"":0.4574151635169983,""surprise"":0.030826203525066376,""fear"":0.015193193219602108}"
"আর ঘরহারা মানুষের কান্না আপনার চোখে পড়েনা?পাবলিকের টাকায় করা(নাম আপনার)সেই ঘর ভেঙে মানুষ মরেছে কতজন সেই হিসাব আছে আপনার কাছে?","","stronglyNegative",-0.9999304056167603,"{""neutral"":0.0010098019847646356,""happy"":0.0008117614779621363,""anger/disgust"":0.9860994219779968,""sadness"":0.05102884769439697,""surprise"":0.009342504665255547,""fear"":0.005448163487017155}"
"আর মানুষের ভোট চুরি করার পর??","","stronglyNegative",-0.9999535083770752,"{""neutral"":0.0039486950263381,""happy"":0.000554538331925869,""anger/disgust"":0.9830137491226196,""sadness"":0.02836138755083084,""surprise"":0.02214432694017887,""fear"":0.0009870072826743126}"
"আর যারা আপনার গুতানিতে ঘুমাতে পারছেনা তাদের দেখলে কেমন লাগে??","","weaklyNegative",-0.5998202085494995,"{""neutral"":0.004673996474593878,""happy"":0.0018499363213777542,""anger/disgust"":0.9068426489830017,""sadness"":0.19526752829551697,""surprise"":0.01142664160579443,""fear"":0.009288864210247993}"
"আর যারা তোমার মতের বিরিদ্দে চলে বলে তাদেরকে রেব দিয়ে গুম এবং খুন করানো হয়েছে তাদের হাহাকার এবং আত্নচিতকার কে পছন্দ করোনা।তোমাকে এই ডাইনি পনার হিসাব দিতে হবে আল্লাহর আদালতে, কথাটা মনে রেখ।","","stronglyNegative",-0.9997057676315307,"{""neutral"":0.006239405367523432,""happy"":0.02126971445977688,""anger/disgust"":0.8697912096977234,""sadness"":0.30194535851478577,""surprise"":0.011493041180074215,""fear"":0.06459511071443558}"
"আর যে গুলারে গুম খুন করেছেন সে গুলার পরিবারের কান্না দেখেছেন?","","stronglyNegative",-0.9999363422393799,"{""neutral"":0.004031319636851549,""happy"":0.0020010732114315033,""anger/disgust"":0.6970335841178894,""sadness"":0.5327827334403992,""surprise"":0.008483253419399261,""fear"":0.01420952845364809}"
"আর সেই ঘর যখন ১৫ দিনের ভেতর ভেঙে পড়ে তখন তাদের কান্না দেখেননা ?","","stronglyNegative",-0.9999391555786132,"{""neutral"":0.0023905481211841106,""happy"":0.000764579395763576,""anger/disgust"":0.16396479308605194,""sadness"":0.9079557657241821,""surprise"":0.023422688245773315,""fear"":0.03260856494307518}"
"আর স্বজনহারা মানুষের আহাজারি........???","","stronglyNegative",-0.9999441623687744,"{""neutral"":0.0009223278029821813,""happy"":0.0003759504179470241,""anger/disgust"":0.00811199564486742,""sadness"":0.9939913153648376,""surprise"":0.0019950231071561575,""fear"":0.0037198560312390327}"
"আলহাদুলিল্লাহ,কিন্তু ঠিকাদররা সিমেন্ট ইউজ করছে!?নাকি অন্য কিছু দিয়া চালাইছে সেটাই দেখার বিষয়.. গৃহহীনদের লিস্টে আবার অনেকে বিবেকহীনও রয়েছে!","","stronglyNegative",-0.9992087364196778,"{""neutral"":0.06568150967359543,""happy"":0.028081567957997322,""anger/disgust"":0.6841244697570801,""sadness"":0.36480164527893066,""surprise"":0.16302239894866943,""fear"":0.14663109183311462}"
"আলহামদুলিল্লাহ","","weaklyPositive",0.5947571992874147,"{""neutral"":0.027430929243564606,""happy"":0.982098400592804,""anger/disgust"":0.0011203858302906156,""sadness"":0.0010573887266218662,""surprise"":0.0043174829334020615,""fear"":0.00026485073613002896}"
"আলহামদুলিল্লাহ, জয় বাংলা।","","stronglyPositive",0.9989250183105469,"{""neutral"":0.0032039021607488394,""happy"":0.9971442818641663,""anger/disgust"":0.0009444193565286696,""sadness"":0.0009814290096983314,""surprise"":0.0032007561530917883,""fear"":0.0002135173126589507}"
"আলহামদুলিল্লাহ।","","stronglyPositive",0.8572766780853273,"{""neutral"":0.01768544688820839,""happy"":0.9892072677612305,""anger/disgust"":0.0010257541434839368,""sadness"":0.001223599654622376,""surprise"":0.0030167056247591972,""fear"":0.00026306696236133575}"
"আল্লাহ জহুরজান বিবির মনের আশা পূরণ করে দেন, আমীন।","","stronglyPositive",0.9996326923370362,"{""neutral"":0.04418536648154259,""happy"":0.9648711085319519,""anger/disgust"":0.0013414850691333413,""sadness"":0.008193650282919407,""surprise"":0.005701850634068251,""fear"":0.002240384230390191}"
"আল্লাহ তায়ালা আপনাকে সাহায্য করবে","","stronglyPositive",0.9992862701416017,"{""neutral"":0.018519984558224678,""happy"":0.9886243343353271,""anger/disgust"":0.0007711665239185095,""sadness"":0.0005538450204767287,""surprise"":0.000991871114820242,""fear"":0.00022373825777322054}"
"আল্লাহ মাননীয় প্রধানমন্ত্রী কে নেক হায়াত দান করুন। আমিন","","stronglyPositive",0.9998129844665529,"{""neutral"":0.02454473078250885,""happy"":0.9818168878555298,""anger/disgust"":0.0004270287463441491,""sadness"":0.0029879482463002205,""surprise"":0.0003153899742756039,""fear"":0.0006715107592754066}"
"আল্লাহ হাজারো অসহায়ের সহায় তুমি মালিক","","stronglyPositive",0.9898711919784546,"{""neutral"":0.12001575529575348,""happy"":0.8406933546066284,""anger/disgust"":0.0028865819331258535,""sadness"":0.010728470981121063,""surprise"":0.0042288159020245075,""fear"":0.012717971578240395}"
"আল্লাহ হেফাজত করুন","","stronglyPositive",0.9997653484344484,"{""neutral"":0.032468535006046295,""happy"":0.02730771340429783,""anger/disgust"":0.00213718693703413,""sadness"":0.02340824529528618,""surprise"":0.010824420489370823,""fear"":0.9284600019454956}"
"আল্লাহ্ মালিক।","","stronglyPositive",0.9844602346420289,"{""neutral"":0.4443495273590088,""happy"":0.09111319482326508,""anger/disgust"":0.0045338282361626625,""sadness"":0.03931832313537598,""surprise"":0.007295763585716486,""fear"":0.32061707973480225}"
"আশ্রয়ন প্রকল্পের ঘর=====মানবতার উজ্জ্বল দৃষ্টান্ত স্থাপন (ভূমিহীন ও গৃহহীনদের জন্য স্বপ্নের নীড়)[] [[[[[[[ []মুজিববর্ষে ঘর পাচ্ছে ৯ লাখ পরিবার।প্রধানমন্ত্রী প্রথম ধাপে ৬৯ হাজার ৯০৪ জনের কাছে বাড়ি হস্তান্তর করবেন।সারা দেশে ভূমি ও গৃহহীন ৮ লাখ ৮৫ হাজার ৬২২ পরিবারকে বাড়ি নির্মাণ করে দিচ্ছে সরকার। জাতির পিতা বঙ্গবন্ধু শেখ মুজিবুর রহমানের জন্মশতবার্ষিকী ‘মুজিববর্ষে’ এটিই হবে প্রধানমন্ত্রী শেখ হাসিনার বিশেষ উপহার।২০২০ সালের ৭ মার্চ প্রধানমন্ত্রী শেখ হাসিনা ঘোষণা দিয়েছিলেন যে দেশের একটি মানুষও গৃহহীন বা ভূমিহীন থাকবে না। আশ্রয়নের অধিকার শেখ হাসিনার উপহার’—এই স্লোগানকে সামনে রেখে মুজিব শতবর্ষে দেশেই নির্মিত হচ্ছে ভূমিহীন ও গৃহহীনদের জন্য এই ‘স্বপ্নের নীড়’।সরকারের হিসাব মতে, সারা দেশে ৮ লাখ ৮৫ হাজার ৬২২টি ভূমিহীন-গৃহহীন পরিবার রয়েছে। এর মধ্যে ঢাকা বিভাগে ১ লাখ ২৯ হাজার ১৯৭, ময়মনসিংহ বিভাগে ৩৬ হাজার ৩, চট্টগ্রাম বিভাগে ১ লাখ ৬১ হাজার ২৯৭, রংপুর বিভাগে ১ লাখ ৮৩ হাজার ৮৩৪, রাজশাহী বিভাগে ৯৬ হাজার ৫০৪, খুলনা বিভাগে ১ লাখ ৪২ হাজার ৪১১, বরিশাল বিভাগে ৮০ হাজার ৫৮৪ এবং সিলেট বিভাগে ৫৫ হাজার ৬২২টি গৃহহীন পরিবার রয়েছে। এর মধ্যে জমি ও ঘর নেই এমন পরিবারের পাশাপাশি ১০ শতাংশ জমি আছে কিন্তু জরাজীর্ণ বাড়ি এমনও পরিবার রয়েছে।","","stronglyPositive",0.9998798370361329,"{""neutral"":0.017460128292441368,""happy"":0.9755655527114868,""anger/disgust"":0.012775233946740627,""sadness"":0.06317316740751266,""surprise"":0.28973039984703064,""fear"":0.01813974231481552}"
"আসসালামু আলাইকুম আসুন আমরা সবাই মানবিক হই,সবার পেইজে সবাই লাইক অ্যান্ড শেয়ার দিয়ে যাই","","stronglyPositive",0.986788058280945,"{""neutral"":0.013309352099895477,""happy"":0.9899476170539856,""anger/disgust"":0.0013600554084405303,""sadness"":0.0008610581862740219,""surprise"":0.0011689405655488372,""fear"":0.00022069345868658274}"
"আহ হা হা !! উপজেলা আওয়ামী লীগের ঈদের খাওন জোগাড় কইরা দিছে প্রধানমন্ত্রী","","weaklyNegative",-0.5987780332565307,"{""neutral"":0.004820185713469982,""happy"":0.9903976917266846,""anger/disgust"":0.008358149789273739,""sadness"":0.0018714829348027706,""surprise"":0.005862350109964609,""fear"":0.0003501623868942261}"
"ইদের আগে ভেঙে না পড়লেই হয়","","weaklyNegative",-0.5997400522232055,"{""neutral"":0.02956365793943405,""happy"":0.010332896374166012,""anger/disgust"":0.17466558516025543,""sadness"":0.5530333518981934,""surprise"":0.014317246153950691,""fear"":0.4867016673088074}"
"ইসলাম নিয়া শহিদ হওয়া তালিবানের সন্তান দের তৈরি ইসলামে এ সবের প্রশংসা করা হারাম।","","stronglyNegative",-0.9998923540115356,"{""neutral"":0.18817827105522156,""happy"":0.0019614859484136105,""anger/disgust"":0.5451255440711975,""sadness"":0.1995837539434433,""surprise"":0.01941181719303131,""fear"":0.04471006616950035}"
"উদ্যোগটা তো ভালো। কিন্তু কথা হচ্ছে এই ঘর গুলো কী মাননীয় প্রধানমন্ত্রী নিজের বেতনের টাকায় দান করবেন? নাকি সরকারি টাকা অর্থ্যাৎ জনগণের টাকায়? যদি মাননীয় প্রধানমন্ত্রীর বেতনের টাকায় হয়ে থাকে তবে এই কাজটি উনার উদারতার পরিচয় বহন করবে। আর যদি তা না হয়ে থাকে তবে এটা কেমন কাজ হচ্ছে?","","neutral",-0.1962819814682007,"{""neutral"":0.14275731146335602,""happy"":0.18002571165561676,""anger/disgust"":0.42421022057533264,""sadness"":0.4231758117675781,""surprise"":0.29524731636047363,""fear"":0.30854591727256775}"
"উনার সাথে যোগাযোগর কোন সঠিক মাধ্যম আছে কি?","","neutral",0.19997119903564453,"{""neutral"":0.9986870884895325,""happy"":0.00034660930396057665,""anger/disgust"":0.0002354499010834843,""sadness"":0.0004853218561038375,""surprise"":0.00034468687954358757,""fear"":0.0006063432083465159}"
"উনি থাকেন কোথায় বিস্তারিত জানান","","neutral",-0.19999027252197266,"{""neutral"":0.999224066734314,""happy"":0.00037929124664515257,""anger/disgust"":0.00017733292770572007,""sadness"":0.00015491544036194682,""surprise"":0.0002612732641864568,""fear"":0.00015040955622680485}"
"উনি সবসময় গণভবন থেকে ভিডিও কনফারেন্স করেন কেন? কাঁচের দেয়ালের আড়ালে থেকে নিজের পিঠ বাঁচিয়ে চলেন। এতো জনপ্রিয় গণমানুষের নেত্রী কেন জনসম্মুখে বেরিয়ে দান ধ্যান করেন না!!!","","weaklyNegative",-0.5995070457458496,"{""neutral"":0.014219585806131363,""happy"":0.003173894016072154,""anger/disgust"":0.7304956316947937,""sadness"":0.25857120752334595,""surprise"":0.26964807510375977,""fear"":0.04441593959927559}"
"উন্নত চিকিৎসাসেবা বিকেন্দ্রীকরণ, চিকিৎসা শিক্ষায় দক্ষ জনবল সৃষ্টি এবং গবেষণা কার্যক্রম উত্তরোত্তর বৃদ্ধির লক্ষ্যে তৃতীয় মেয়াদে প্রধানমন্ত্রীর দায়িত্ব পালনকালে শেখ হাসিনা রাজশাহী মেডিকেল বিশ্ববিদ্যালয়, চট্টগ্রাম মেডিকেল বিশ্ববিদ্যালয় ও সিলেট মেডিকেল বিশ্ববিদ্যালয় চালু করেছে। সমপ্রতি খুলনা মেডিকেল বিশ্ববিদ্যালয়ের ঘোষণা দেয়া হয়েছে। ধন্যবাদ প্রধানমন্ত্রী শেখ হাসিনারকে।","","stronglyPositive",0.9717818975448609,"{""neutral"":0.004644591826945543,""happy"":0.9959962368011475,""anger/disgust"":0.0021896553225815296,""sadness"":0.005199046805500984,""surprise"":0.017718752846121788,""fear"":0.0011927129235118628}"
"উন্নয়ন","","weaklyPositive",0.5992907285690309,"{""neutral"":0.6641795635223389,""happy"":0.2901383936405182,""anger/disgust"":0.05264122784137726,""sadness"":0.014202858321368694,""surprise"":0.005454476922750473,""fear"":0.0025022251065820456}"
"উন্নয়ন","","weaklyPositive",0.5992907285690309,"{""neutral"":0.6641795635223389,""happy"":0.2901383936405182,""anger/disgust"":0.05264122784137726,""sadness"":0.014202858321368694,""surprise"":0.005454476922750473,""fear"":0.0025022251065820456}"
"উন্নয়ন গেলো কই??","","weaklyNegative",-0.5996150493621826,"{""neutral"":0.08825864642858505,""happy"":0.004937235731631517,""anger/disgust"":0.47676703333854675,""sadness"":0.2999580502510071,""surprise"":0.32134756445884705,""fear"":0.014589823782444}"
"উন্নয়ন বিশেষজ্ঞরা এখন বাংলাদেশকে দারিদ্র্য বিমোচন ও উন্নয়নের জন্য একটি রোল মডেল হিসেবে উপস্থাপন করছেন। ধন্যবাদ আমাদের প্রধানমন্ত্রী শেখ হাসিনাকে।","","stronglyPositive",0.9869152545928956,"{""neutral"":0.0012248322600498796,""happy"":0.9986048340797424,""anger/disgust"":0.0011303588980808854,""sadness"":0.0011032704496756196,""surprise"":0.004231625702232122,""fear"":0.0001772374234860763}"
"উপহার","","weaklyPositive",0.5996148109436036,"{""neutral"":0.05785903334617615,""happy"":0.9233918786048889,""anger/disgust"":0.00502704968675971,""sadness"":0.0016942176735028625,""surprise"":0.026125093922019005,""fear"":0.0005994293023832142}"
