"paragraph","message","polarity_class","polarity_score","emotion"
"এ তো শালা তেলের সাগরে এসে পড়লাম","","stronglyNegative",-0.999878978729248,"{""neutral"":0.015148410573601723,""happy"":0.010885264724493027,""anger/disgust"":0.8133938312530518,""sadness"":0.14283256232738495,""surprise"":0.039460163563489914,""fear"":0.0050543914549052715}"
"এই খবর আওয়ামীলীগের নেতারা পড়লে বলে বসবে আরে আমাদের মাথাপিছু আয় ২৫০০ ডলার, সবাই আমরা চুতিয়া বড়লোক। এই খবর মিথ্যা। সব বিএনপি জামাত এর ষড়যন্ত্র","","stronglyNegative",-0.9546096563339234,"{""neutral"":0.0007314921822398901,""happy"":0.0006886438350193202,""anger/disgust"":0.9908488988876343,""sadness"":0.057616692036390305,""surprise"":0.001800781930796802,""fear"":0.0022792231757193804}"
"এই ঘর নির্মাণের সাথে যারা জড়িত ছিল, সবার ব্যাংক একাউন্ট চেক করার দাবি জানাই...","","weaklyPositive",0.5950162649154664,"{""neutral"":0.7340965867042542,""happy"":0.004801561124622822,""anger/disgust"":0.2822958528995514,""sadness"":0.01313426811248064,""surprise"":0.004512077197432518,""fear"":0.0025483015924692154}"
"এই ঘর পাওয়ার পেছনে তদবির করতে গিয়ে কত টাকা খরচ হয়েছে সেটা না হয় বাদ দিলাম তবু দোয়া করি আল্লাহ এই সমস্ত গৃহের মালিকদেরকে টর্নেডো থেকে হেফাজত করুন।","","stronglyPositive",0.9995789289474488,"{""neutral"":0.018910294398665428,""happy"":0.04775434359908104,""anger/disgust"":0.011877093464136124,""sadness"":0.07870101928710938,""surprise"":0.018124915659427643,""fear"":0.9513069987297058}"
"এই ঘরের মেয়াদ পাঁচ বছর।","","neutral",0.19998743534088137,"{""neutral"":0.9991832375526428,""happy"":0.00021554212435148656,""anger/disgust"":0.0002917408710345626,""sadness"":0.00022216392972040921,""surprise"":0.0005338447517715394,""fear"":0.00017398054478690028}"
"এই দেশে সরকারের তরফ থেকে কোনো কিছু পেতে হলে দলীয় পরিচয়ে লাগেতানা হলে কোন কিছু পাওয়া যায় না।যদিও কেউ কেউ পায় তাও মোটা অংকের টাকা ঘুষ দিয়ে, এই হলো ডিজিটাল বাংলাদেশর উন্নয়ন","","weaklyNegative",-0.4847881555557251,"{""neutral"":0.001978297485038638,""happy"":0.005516740493476391,""anger/disgust"":0.945838987827301,""sadness"":0.3329318165779114,""surprise"":0.006260123569518328,""fear"":0.016151826828718185}"
"এই বাড়িগোলা কার টাকাই বানানো হয় ছে কারো বেনিটি বেগের টাকা ,নাকি জনগনের টাকা","","stronglyNegative",-0.9907816648483276,"{""neutral"":0.14565517008304596,""happy"":0.009408953599631786,""anger/disgust"":0.7657500505447388,""sadness"":0.11287296563386917,""surprise"":0.06855859607458115,""fear"":0.01666214130818844}"
"এই বাড়ীগু‌লি কি জনগ‌নের ভ‌্যাট ট‌্যা‌ক্সের টাকায় তৈরী?","","neutral",-0.19996124505996704,"{""neutral"":0.08242630958557129,""happy"":0.002701588673517108,""anger/disgust"":0.8330907225608826,""sadness"":0.06473281979560852,""surprise"":0.08667408674955368,""fear"":0.013456850312650204}"
"এই বাসস্থান যাদেরকে দিছে, তাদের তাদের ছবি ও নাম প্রকাশ করলে বুজা যেতো আসলে এই বাসস্থান কারা পাইছে।","","weaklyNegative",-0.4664221048355102,"{""neutral"":0.8541948795318604,""happy"":0.005156253930181265,""anger/disgust"":0.1476670205593109,""sadness"":0.03802275285124779,""surprise"":0.025181757286190987,""fear"":0.008343747816979885}"
"এই বৈশাখ মাসেই যেন ঝড়ে উড়িয়ে নিয়ে না যায়।","","weaklyNegative",-0.5998530864715577,"{""neutral"":0.006885521579533815,""happy"":0.006919204723089933,""anger/disgust"":0.006799411494284868,""sadness"":0.06661656498908997,""surprise"":0.017489569261670113,""fear"":0.9773872494697571}"
"এই সমস্ত কথা শুনতে ও ভালো লাগে","","weaklyPositive",0.4991546630859376,"{""neutral"":0.00013789399235974997,""happy"":0.9997972846031189,""anger/disgust"":0.00015052103844936937,""sadness"":0.0003427117189858109,""surprise"":0.00030129236984066665,""fear"":0.000012540037459984887}"
"এইগুলা কি উনার ব্যাক্তিগত তহবিল থেকে দিয়েছেন নাকি জনগনের টাকায় দিচ্ছেন তাও ব্যবসা করে","","weaklyNegative",-0.5998270273208618,"{""neutral"":0.011989906430244446,""happy"":0.001589306746609509,""anger/disgust"":0.9572188258171082,""sadness"":0.05099288746714592,""surprise"":0.04483695700764656,""fear"":0.00621079420670867}"
"এইটা সরকারের প্রশংসনীয় উদ্যোগ","","weaklyPositive",0.5992158174514771,"{""neutral"":0.0005960338748991489,""happy"":0.9992080330848694,""anger/disgust"":0.0005226017674431205,""sadness"":0.0003839392738882452,""surprise"":0.0016304044984281063,""fear"":0.00004453702786122449}"
"এক যুগের বেশি পথ চলায় প্রমাণিত হয়েছে, ডিজিটাল বাংলাদেশ জননেত্রী শেখ হাসিনার এক উন্নয়ন দর্শন।","","stronglyPositive",0.999805498123169,"{""neutral"":0.007285021245479584,""happy"":0.9892560243606567,""anger/disgust"":0.0024575116112828255,""sadness"":0.0007900320342741907,""surprise"":0.008720827288925648,""fear"":0.000221769223571755}"
"কয়েকটা গ্রামে এ নিয়ে খবর নিয়েছি-যথাযথ ডিস্ট্রিবিউশন হয়নি বলে প্রান্তিক জনগোষ্ঠী প্রকৃত সেবা থেকে বঞ্চিত হয়েছে। সরকারের এই উন্নয়ন সঠিকভাবে পঁৌছে দেওয়া হোক বাংলার গরীবের ঘরে।❣️","","weaklyPositive",0.510372805595398,"{""neutral"":0.01584913209080696,""happy"":0.17150002717971802,""anger/disgust"":0.05843609571456909,""sadness"":0.9392459988594055,""surprise"":0.006981763523072004,""fear"":0.0223959032446146}"
"কয়েকদিন আগে দেখলাম পাশে টিন আছে, উপরে নাই। তুফানে নিয়া গেছে","","weaklyNegative",-0.5998615264892577,"{""neutral"":0.004551760386675596,""happy"":0.0016165768029168248,""anger/disgust"":0.0073790159076452255,""sadness"":0.9243050217628479,""surprise"":0.013532397337257862,""fear"":0.4577343463897705}"
"করোনা ভাইরাসের মধ্যে প্রধানমন্ত্রী শেখ হাসিনা এবং তার সরকার ঘরে ঘরে অসহায়দের খাদ্য ও আর্থিক সহায়তা দিয়েছে।","","stronglyPositive",0.9999018907546998,"{""neutral"":0.00035553876659832895,""happy"":0.9995200634002686,""anger/disgust"":0.00025738286785781384,""sadness"":0.0005599177093245089,""surprise"":0.007244904525578022,""fear"":0.00007724136230535805}"
"করোনায় যখন গোটা বিশ্ব লণ্ডভণ্ড তখন প্রধানমন্ত্রী শেখ হাসিনার দূরদর্শী নেতৃত্বে বাংলাদেশ সফল।","","stronglyPositive",0.9999485015869142,"{""neutral"":0.0014568966580554843,""happy"":0.9983727335929871,""anger/disgust"":0.002147570252418518,""sadness"":0.00362460152246058,""surprise"":0.006078803911805153,""fear"":0.0005300945485942066}"
"কাকিমা ,আমার কপালে কি একটা বাড়ি যুটবে না! আর কতকাল বাড়ি ছাড়া থাকতে হবে।","","weaklyNegative",-0.5472026824951172,"{""neutral"":0.0006961138569749892,""happy"":0.0007660025730729103,""anger/disgust"":0.01764940656721592,""sadness"":0.9899628758430481,""surprise"":0.0019929155241698027,""fear"":0.016650496050715446}"
"কাতার অবস্থা ভাল না বাংলাদের অবস্থা ভাল বুঝরাম না আজকে টাকার রেট ২৫ টাকা","","stronglyNegative",-0.9444169044494629,"{""neutral"":0.010425843298435211,""happy"":0.0026949995663017035,""anger/disgust"":0.13812829554080963,""sadness"":0.9172483682632446,""surprise"":0.0138804716989398,""fear"":0.06932383030653}"
"কারা পাচ্ছে সেটাই বিবেচ্য বিষয়। নির্দলীয় তত্ত্বাবধানে যদি বন্টন হয় তাহলে ঠিক আছে অন্যথায় এটা প্রচারনা ছাড়া কিছুই না।","","weaklyNegative",-0.5997492074966431,"{""neutral"":0.10185060650110245,""happy"":0.03344953432679176,""anger/disgust"":0.7208078503608704,""sadness"":0.19471485912799835,""surprise"":0.011796565726399422,""fear"":0.022493818774819374}"
"কি আর বলি,, অনেক কষ্ট লাগে","","stronglyNegative",-0.9998470306396484,"{""neutral"":0.000500463938806206,""happy"":0.0016244295984506607,""anger/disgust"":0.00035847918479703367,""sadness"":0.9988489151000977,""surprise"":0.00044966230052523315,""fear"":0.001521914266049862}"
"কি করুন উক্তি।,😭😭😭😭","","neutral",0.1962749481201172,"{""neutral"":0.001971673220396042,""happy"":0.0005610970547422767,""anger/disgust"":0.006408307235687971,""sadness"":0.9827856421470642,""surprise"":0.005808201618492603,""fear"":0.10488297045230865}"
"কেওনা কেও এগিয়ে আসবেন","","weaklyPositive",0.5997048139572144,"{""neutral"":0.5713374018669128,""happy"":0.44278977,""anger/disgust"":0.009752494283020496,""sadness"":0.012477255426347256,""surprise"":0.0022182760294526815,""fear"":0.004858037456870079}"
"কোথায় চুরের বাচ্চারা দেখে যা তরা কাদের টাকা চুরি করছ","","stronglyNegative",-0.9999253988265991,"{""neutral"":0.00013993357424624264,""happy"":0.0001488218695158139,""anger/disgust"":0.9997177720069885,""sadness"":0.0013825458008795977,""surprise"":0.0004967084969393909,""fear"":0.000016277908798656426}"
"ক্যামনে পাইবো সর্ব ক্ষেএে রাজনীতি এদেশে 🇧🇩😭😭🤣✌️✌️","","stronglyNegative",-0.9999134778976441,"{""neutral"":0.04966549947857857,""happy"":0.004541461821645498,""anger/disgust"":0.8742982745170593,""sadness"":0.06188352778553963,""surprise"":0.10011577606201172,""fear"":0.008016820065677166}"
"ক্যায়সা লাগা ম্যারা মাজাক 🥴🥴🥴","","neutral",-0.19584450721740723,"{""neutral"":0.1482006311416626,""happy"":0.01023393776267767,""anger/disgust"":0.5634344220161438,""sadness"":0.12235988676548004,""surprise"":0.21177342534065247,""fear"":0.02382800541818142}"
"খড় কুঠার ঘরের চেয়েও নিম্ন মানের ঘর দিয়ে গরীব মানুষের সাথে উপহাস করেছেন, মাননীয় অবৈধ প্রধানমন্ত্রী।","","stronglyNegative",-0.9999484539031982,"{""neutral"":0.00043979447218589485,""happy"":0.0004134041373617947,""anger/disgust"":0.9950085878372192,""sadness"":0.0334102138876915,""surprise"":0.002131205750629306,""fear"":0.0008206000202335417}"
"খুবই দুঃখজনক কারন প্রকৃত গৃহহীন ভূমিহীন মানুষ গুলো এসুবিধা পাচ্ছে না ।","","stronglyNegative",-0.9999442577362061,"{""neutral"":0.0002059353282675147,""happy"":0.00044077704660594463,""anger/disgust"":0.006046791095286608,""sadness"":0.9991835951805115,""surprise"":0.00041701176087372005,""fear"":0.0016748305642977357}"
"গত দুই বছর আগে আমাদের হবিগঞ্জ জেলার বাহুবল থানা, পুটিজুরী ইউনিয়নে সরকারি ঘর এসেছে, আমার মায়ের ছোট একটা একচালা ঘর, চারপাশে ভাঙ্গা, কতো নেতার হাতে পায়ে ধরে ও ঘর পাওয়া যায় নি, আমি উপজেলায় কতোবার কাগজ পত্র জমা দিছি, কোন কাজ হয়নি,আমার স্বামী অন্য মেয়ে কে বিয়ে করে চলে গেছে, আমি মায়ের কাছে আছি, আমার একটা এগারো বছরের মেয়ে আছে, অন্যের বাসা বাড়িতে ঝিয়ের কাজ করি,আমি কি সরকারি ঘর পাওয়ার যোগ্য না? আমার ভাই বোন কেউ নাই, আমি নিজে তিন জনের সংসার চালাই,সাংবাদিক ভাই আপনি চেষ্টা করলে হয়তো সরকারি ঘর পেতে পারি, প্লিজ ভাই, আপনার পায়ে ধরি,আপনি চেষ্টা করবেন,","","weaklyNegative",-0.5989726305007934,"{""neutral"":0.005886780563741922,""happy"":0.015297179110348225,""anger/disgust"":0.1144193485379219,""sadness"":0.9588844776153564,""surprise"":0.016923407092690468,""fear"":0.14413699507713318}"
"গতকাল মঙ্গলবার যেই ঘর দেওয়া হলো। সেই ছবি এই সাংবাদিক দখে।নাই।?? এই মহিলার জন্য কেউ যদি জেলা প্রশাসকের কাছে আবেদন করে তাহলে তার একটা গতি হবে।","","weaklyNegative",-0.5994649410247803,"{""neutral"":0.12218119204044342,""happy"":0.07598987221717834,""anger/disgust"":0.6316277980804443,""sadness"":0.31907811760902405,""surprise"":0.10415343195199966,""fear"":0.062053341418504715}"
"গতবাতের গুলা তো এক সপ্তাহ পরেই বেঙে পরকছিলো এইবারের গুলাও কি একই নাকি মাস খানেক টিকবে.??","","neutral",-0.19972593784332277,"{""neutral"":0.6482849717140198,""happy"":0.012844639830291271,""anger/disgust"":0.15833009779453278,""sadness"":0.13441002368927002,""surprise"":0.10948265343904495,""fear"":0.11198064684867859}"
"গরীব হোলে হয়নাগো মা! ঘর পেতে গেলে দলীয় হতে হয়!😭","","weaklyNegative",-0.5995846748352051,"{""neutral"":0.005141588859260082,""happy"":0.0008970824419520795,""anger/disgust"":0.053899966180324554,""sadness"":0.95611172914505,""surprise"":0.00360870361328125,""fear"":0.012496317736804485}"
"গাজীপুরে ৪ হাজার একর জমি নিয়ে বঙ্গবন্ধু শেখ মুজিব সাফারি পার্ক তৈরি, জীববৈচিত্র্য সংরক্ষণে জাতীয় পুরস্কারের প্রবর্তন, বায়ুদূষণ রোধে টেকসই পরিবেশ শীর্ষক প্রকল্প গ্রহণ, বর্জ্য ব্যবস্থাপনার ক্ষেত্রে বেশ কিছু কর্মসূচি পরিবেশ উন্নয়নে ভূমিকা রেখেছে। মাননীয় প্রধানমন্ত্রী শেখ হাসিনা ছাড়া তা কোনো ভাবেই সম্ভব ছিল না।","","stronglyPositive",0.9999258279800416,"{""neutral"":0.023982251062989235,""happy"":0.9757398366928101,""anger/disgust"":0.014465795829892159,""sadness"":0.1051015704870224,""surprise"":0.06959681212902069,""fear"":0.01942959800362587}"
"গুম হওয়া পরিবারের চোখের পানিও আপনি খুব পছন্দ করেন।","","stronglyPositive",0.9996592521667482,"{""neutral"":0.0009351363405585289,""happy"":0.9952925443649292,""anger/disgust"":0.00821953359991312,""sadness"":0.007417780347168446,""surprise"":0.006834808737039566,""fear"":0.0002178975410060957}"
"গুম হওয়া মানুষের পরিবারের সদস্যদের কান্না টাও পছন্দের তালিকায় আনুন। 😜😜","","weaklyNegative",-0.4586092948913574,"{""neutral"":0.15592622756958008,""happy"":0.03030475415289402,""anger/disgust"":0.5300118923187256,""sadness"":0.3577844500541687,""surprise"":0.030649978667497635,""fear"":0.021083833649754524}"
"গ্লোবাল জেন্ডার গ্যাপ রিপোর্ট ২০১৫ অনুযায়ী রাজনৈতিক ক্ষমতায়নে বাংলাদেশ বিশ্বে ষষ্ঠ স্থানে রয়েছে। সবই শেখ হাসিনার কৃতিত্ব।","","stronglyPositive",0.9998273611068726,"{""neutral"":0.008002460934221745,""happy"":0.9902791380882263,""anger/disgust"":0.008082551881670952,""sadness"":0.004655684344470501,""surprise"":0.005923402030020952,""fear"":0.000777542416471988}"
"ঘর আবার ভেঙে না পড়ে","","weaklyNegative",-0.5947066307067871,"{""neutral"":0.007687094155699015,""happy"":0.0013211758341640234,""anger/disgust"":0.009253190830349922,""sadness"":0.19377736747264862,""surprise"":0.006145755760371685,""fear"":0.959159791469574}"
"ঘর কয়দিন টিকবে এটাই বড় কথা।","","neutral",0.19902669191360475,"{""neutral"":0.12197184562683105,""happy"":0.006235164124518633,""anger/disgust"":0.4344363212585449,""sadness"":0.2848711311817169,""surprise"":0.00569358142092824,""fear"":0.010277800261974335}"
"ঘর তাহলে সব আওয়ামী লীগের লোকজন পায়","","weaklyNegative",-0.582397747039795,"{""neutral"":0.0014229672960937023,""happy"":0.0005512110074050725,""anger/disgust"":0.9973624348640442,""sadness"":0.0015158584574237466,""surprise"":0.0010929337004199624,""fear"":0.00004720672586699948}"
"ঘর তো ফ্রি-তে পায় না , এগুলোর জন্য গরীবদের টাকাও গুনতে হয় আবার ভোগান্তিও পোহাতে হয় । 🙂","","stronglyNegative",-0.9990357875823974,"{""neutral"":0.0014479801757261157,""happy"":0.0010000155307352543,""anger/disgust"":0.03555639833211899,""sadness"":0.9960816502571106,""surprise"":0.0014161794679239392,""fear"":0.0054815225303173065}"
"ঘর না পাওয়া আমি😰","","weaklyNegative",-0.599792218208313,"{""neutral"":0.06718193739652634,""happy"":0.002131496788933873,""anger/disgust"":0.01215628907084465,""sadness"":0.9153891801834106,""surprise"":0.008524423465132713,""fear"":0.008609537966549397}"
"ঘর পাওয়ার জন্য টাকার প্রয়োজন খালা😥","","weaklyPositive",0.5812953472137452,"{""neutral"":0.8619292974472046,""happy"":0.003924614749848843,""anger/disgust"":0.02102007530629635,""sadness"":0.13519327342510223,""surprise"":0.02133612520992756,""fear"":0.015577943064272404}"
"ঘর পেতে হলে ঘুষ দিতে হয়, হয়তো ইনি তা জানেন না,জানলে আগে ঘুষের টাকার ব্যবস্থা করতেন,আর বাংলাদেশের মত চোরের দেশে এটাই করুণ বাস্তবতা","","stronglyNegative",-0.9999202966690064,"{""neutral"":0.0005911297630518675,""happy"":0.0008357175393030047,""anger/disgust"":0.9817211627960205,""sadness"":0.23230844736099243,""surprise"":0.002806051168590784,""fear"":0.004174539819359779}"
"ঘর পে‌য়ে মানুষ যতটা খু‌শি, তার চে‌য়ে বেশী খু‌শি হ‌বে য‌দি সক‌লের ভোটাধিকার ফি‌রি‌য়ে দেন।","","stronglyPositive",0.9998465061187745,"{""neutral"":0.00790289044380188,""happy"":0.9893139004707336,""anger/disgust"":0.007655351422727108,""sadness"":0.0046164426021277905,""surprise"":0.002064834348857403,""fear"":0.00040296203223988414}"
"ঘরে না ফেরা মানুষের পরিজনদের কান্না কেমন লাগে?","","neutral",-0.1772389888763428,"{""neutral"":0.0017003840766847134,""happy"":0.00048207619693130255,""anger/disgust"":0.001851425739005208,""sadness"":0.9964926838874817,""surprise"":0.0010069592390209436,""fear"":0.0063477312214672565}"
"ঘরে যাওয়ার আগেই সেটা ভেঙে য়াওয়ার আর্তনাদ আরো মজা দায়ক🥴😒","","stronglyNegative",-0.9998996496200562,"{""neutral"":0.0017070790054276586,""happy"":0.0010365674970671535,""anger/disgust"":0.01640251651406288,""sadness"":0.9839058518409729,""surprise"":0.002825816860422492,""fear"":0.0087025361135602}"
"চমৎকার","","stronglyPositive",0.9999115705490114,"{""neutral"":0.051644954830408096,""happy"":0.8785852193832397,""anger/disgust"":0.004078314173966646,""sadness"":0.0014684273628517985,""surprise"":0.17502900958061218,""fear"":0.0007933579036034644}"
"চাছি তোমার টাকাও নাই,ঘরও নাই।","","stronglyNegative",-0.9999108076095581,"{""neutral"":0.0013719785492867231,""happy"":0.0009063662146218121,""anger/disgust"":0.9842835664749146,""sadness"":0.03474794700741768,""surprise"":0.0045449635945260525,""fear"":0.0011899054516106844}"
"জনগনের টাকায় তৈরি করা ঘড়তাহলে এটা হবে জনগনের দেওয়া উপহার","","stronglyPositive",0.999868154525757,"{""neutral"":0.035174690186977386,""happy"":0.8933371901512146,""anger/disgust"":0.10813511162996292,""sadness"":0.007481639739125967,""surprise"":0.017876461148262024,""fear"":0.0012618154287338257}"
"জনগনের টাকার ঘর জনগনকে দিচ্ছে। উপহার পাইছে যারা রডের বদলে বাশ দিয়ে ঘর বানাইছে।","","weaklyNegative",-0.5982247829437255,"{""neutral"":0.0007331678061746061,""happy"":0.0009849778143689036,""anger/disgust"":0.9952078461647034,""sadness"":0.0184859037399292,""surprise"":0.004126376006752253,""fear"":0.0008968577603809536}"
"জননেত্রী শেখ হাসিনা অবকাঠামোগত উন্নয়নে বড় সাফল্য পেয়েছেন। বাংলাদেশের ইতিহাসে যে কয়জন প্রধাণমন্ত্রী ছিলেন তাদের মধ্যে তার অবদান উল্লেখ যোগ্য।","","stronglyPositive",0.9999132871627809,"{""neutral"":0.0001331169332843274,""happy"":0.9998027682304382,""anger/disgust"":0.00046001398004591465,""sadness"":0.0011412302264943719,""surprise"":0.004295282997190952,""fear"":0.00007044748053885996}"
"জননেত্রী শেখ হাসিনার কল্যাণে সারাদেশে বর্তমানে সাড়ে ১৩ হাজার কমিউনিটি ক্লিনিক চালু রয়েছে।","","stronglyPositive",0.9999451637268068,"{""neutral"":0.004789051599800587,""happy"":0.9953359961509705,""anger/disgust"":0.0009358494426123798,""sadness"":0.0005333073786459863,""surprise"":0.005114058963954449,""fear"":0.00010989322618115693}"
