"paragraph","message","polarity_class","polarity_score","emotion"
"জননেত্রী শেখ হাসিনার দূরদর্শী নেতৃত্বে নারী-পুরুষ সমতা, রপ্তানিমুখী শিল্পায়ন, ১০০টি বিশেষ অর্থনৈতিক অঞ্চল, বঙ্গবন্ধু স্যাটেলাইট-১ উৎক্ষেপণ, রপ্তানি আয় বৃদ্ধিসহ বিভিন্ন অর্থনৈতিক সূচকে দেশ এগিয়ে যাচ্ছে। নান্দনিক পদ্মা সেতু, পারমাণবিক বিদ্যুৎ কেন্দ্র, গভীর সমুদ্রবন্দর, ঢাকা মেট্রো রেলসহ দেশের মেগাপ্রকল্পগুলো দ্রুত গতিতে এগিয়ে চলছে।","","stronglyPositive",0.9999165296554566,"{""neutral"":0.0002983137674164027,""happy"":0.9996339082717896,""anger/disgust"":0.0004435675509739667,""sadness"":0.0012247096747159958,""surprise"":0.008376598358154297,""fear"":0.00015006288595031947}"
"জননেত্রী শেখ হাসিনার সাহসী এবং গতিশীল উন্নয়ন কৌশল গ্রহণের ফলে সামগ্রিক অর্থনৈতিক প্রবৃদ্ধি, কাঠামোগত রূপান্তর এবং উল্লেখযোগ্য সামাজিক অগ্রগতির মাধ্যমে বাংলাদেশকে দ্রুত উন্নয়নের পথে নিয়ে এসেছে।","","stronglyPositive",0.9999549865722657,"{""neutral"":0.00038168177707120776,""happy"":0.9994634985923767,""anger/disgust"":0.00018546503270044923,""sadness"":0.000334643991664052,""surprise"":0.007496295031160116,""fear"":0.00008226855425164104}"
"জনপ্রতিনিধিরা কত টাকা করে গোপনে নিয়েছেন সেটা অনুসন্ধান চাই।","","neutral",-0.19965624809265137,"{""neutral"":0.008971359580755234,""happy"":0.0009982374031096697,""anger/disgust"":0.9620498418807983,""sadness"":0.01941634900867939,""surprise"":0.07115776836872101,""fear"":0.002511696657165885}"
"জয় তো মাননীয় প্রধানমন্ত্রী শেখ হাসিনার","","stronglyPositive",0.9998251676559449,"{""neutral"":0.002381311496719718,""happy"":0.9963609576225281,""anger/disgust"":0.0017427969723939896,""sadness"":0.0004979593213647604,""surprise"":0.0009145566145889461,""fear"":0.00008057927334448323}"
"জয় বাংলা জয় বঙ্গবন্ধু","","stronglyPositive",0.9990674257278443,"{""neutral"":0.022518666461110115,""happy"":0.9827143549919128,""anger/disgust"":0.001944372896105051,""sadness"":0.0007497743354178965,""surprise"":0.0014269460225477815,""fear"":0.0003279189404565841}"
"জয় বাংলা জয় বঙ্গবন্ধু জয় শেখ হাসিনা!!!🥰🥰🥰","","stronglyPositive",0.9997781991958619,"{""neutral"":0.17919212579727173,""happy"":0.8634775876998901,""anger/disgust"":0.0154764074832201,""sadness"":0.005559968762099743,""surprise"":0.02717839553952217,""fear"":0.00295540620572865}"
"জয় বাংলা জয় বঙ্গবন্ধু জয়তু দেশরত্ন শেখ হাসিনা 🇧🇩","","stronglyPositive",0.9999548435211183,"{""neutral"":0.014817310497164726,""happy"":0.9871259331703186,""anger/disgust"":0.0011250285897403955,""sadness"":0.000488472287543118,""surprise"":0.0012813201174139977,""fear"":0.00018538511358201504}"
"জয়তু জননেত্রী শেখ হাসিনা ❤❤। আপনার দীর্ঘায়ু কামনা করি।","","stronglyPositive",0.9996797800064088,"{""neutral"":0.06502126902341843,""happy"":0.956307053565979,""anger/disgust"":0.0017085797153413296,""sadness"":0.0013215162325650454,""surprise"":0.0010972416494041681,""fear"":0.00046269354061223567}"
"জয়তু দেশরত্ন শেখ হাসিনা।","","stronglyPositive",0.999948787689209,"{""neutral"":0.002158450661227107,""happy"":0.9975473284721375,""anger/disgust"":0.0008177653071470559,""sadness"":0.00046965471119619906,""surprise"":0.00043891664245165884,""fear"":0.00008063638961175457}"
"জয়তু মাননীয় প্রধানমন্ত্রী।","","stronglyPositive",0.9997287750244142,"{""neutral"":0.04859530180692673,""happy"":0.9699242115020752,""anger/disgust"":0.001258808420971036,""sadness"":0.0009659896604716778,""surprise"":0.0009040094446390867,""fear"":0.0002513892250135541}"
"জলবায়ু প্রভাবজনিত ক্ষয়ক্ষতি মোকাবিলায় বাংলাদেশের সাফল্য বিশ্ব স্বীকৃত। জননেত্রী শেখ হাসিনার নিকট বাংলাদেশের মানুষ সত্যি ঋণী।","","stronglyPositive",0.9999411582946778,"{""neutral"":0.0002867313160095364,""happy"":0.999544084072113,""anger/disgust"":0.0005815850454382598,""sadness"":0.0008428141591139138,""surprise"":0.0011654344853013754,""fear"":0.00005043429700890556}"
"জাতিসংঘের সাবেক মহাসচিব বান কি মুন বাংলাদেশকে উন্নয়নের রোল মডেল হিসেবে আখ্যায়িত করেছেন। ' শেখ হাসিনা ক্ষমতায় না থাকলে এটা কখনই সম্ভব হতো না।","","weaklyPositive",0.5278298854827882,"{""neutral"":0.05190151557326317,""happy"":0.9743258953094482,""anger/disgust"":0.002678573364391923,""sadness"":0.010136458091437817,""surprise"":0.03249896690249443,""fear"":0.003038957482203841}"
"জাতীয় কবি রিয়াজ চামচারে দেখান","","weaklyPositive",0.5976491689682008,"{""neutral"":0.00151959084905684,""happy"":0.00025543372612446547,""anger/disgust"":0.9987633228302002,""sadness"":0.00036128441570326686,""surprise"":0.0009748607990331948,""fear"":0.000013975614820083138}"
"জীবনযাত্রার মান বৃদ্ধির কারণে দেশের মানুষের গড় আয়ু ৭১ বছরের বেশি (নারীদের ৭৫ বছর এবং পুরুষদের ৭১ বছর) হয়েছে। ধন্যবাদ জননেত্রী শেখ হাসিনা।","","stronglyPositive",0.9969862461090089,"{""neutral"":0.0009112612460739911,""happy"":0.999029278755188,""anger/disgust"":0.0006305555580183864,""sadness"":0.0016273491783067584,""surprise"":0.006366272456943989,""fear"":0.0002033637574641034}"
"টাকা তো জনগনের ঘর গুলি জনগণ দিসে, প্রধানমন্ত্রী না । প্রধানমন্ত্রী বেশি হলে এইখান থিকে টাকা চুরি করসে । স্ট্যান্টবাজি |","","stronglyNegative",-0.9997734785079956,"{""neutral"":0.0009699713555164635,""happy"":0.0009443684830330312,""anger/disgust"":0.9950657486915588,""sadness"":0.0198171678930521,""surprise"":0.0026383069343864918,""fear"":0.001109244185499847}"
"ডিজিটাল বাংলাদেশ গঠনের লক্ষ্যে শেখ হাসিনার সরকারের নানামুখী পদক্ষেপ ছিল দৃশ্যমান।","","stronglyPositive",0.99960196018219,"{""neutral"":0.0006511028041131794,""happy"":0.9990457892417908,""anger/disgust"":0.0005742851062677801,""sadness"":0.00045321896323002875,""surprise"":0.0015574382850900292,""fear"":0.00005210478411754593}"
"তথ্য প্রযুক্তির সেবা তৃণমূলে পৌঁছে দেওয়া ছিল অভূতপূর্ব। দেশের মানুষ শেখ হাসিনার এই অবদান সারা জীবন মনে রাখবে।","","stronglyPositive",0.9999213457107545,"{""neutral"":0.00024577241856604815,""happy"":0.9995360374450684,""anger/disgust"":0.0007059476338326931,""sadness"":0.000848549185320735,""surprise"":0.00499091949313879,""fear"":0.00008324005466420203}"
"তাকে সহোযোগিতার জন্য সংশ্লিষ্ট এলাকা বাসীর দ্রুত এগিয়ে আসা উচিত, আমরা নিজেদেরকে শ্রেষ্ঠ জীব হিসেবে পরিচয় দিচ্ছি অথচ অসহায় মানুষের দিকে দায়িত্বের হাত বাড়াচ্ছি না। অসহায়, দরিদ্র, নিপীড়িত মানুষের পাশে দাঁড়ানো নিশ্চয়ই নেক আমল।","","stronglyPositive",0.9991227388381959,"{""neutral"":0.0706874430179596,""happy"":0.8409155607223511,""anger/disgust"":0.05486065894365311,""sadness"":0.3982994556427002,""surprise"":0.04015374556183815,""fear"":0.1086704432964325}"
"তার মত ভালা মানুষ মুই জীবনেও দেখি নাই","","stronglyPositive",0.999970293045044,"{""neutral"":0.000028148637284175493,""happy"":0.9999346733093262,""anger/disgust"":0.000049294194468529895,""sadness"":0.00014015204214956611,""surprise"":0.8186894655227661,""fear"":0.000020397605112520978}"
"তাহলে অাশ্রায়ন প্রকল্পের ঘর পায় কে??","","neutral",-0.19997639656066896,"{""neutral"":0.8538417816162109,""happy"":0.0030456162057816982,""anger/disgust"":0.11954808980226517,""sadness"":0.020923493430018425,""surprise"":0.07871571183204651,""fear"":0.006990274880081415}"
"তাহলে আপনিই ব‌্যবস্হা করে দেন।।।","","weaklyPositive",0.5730484008789063,"{""neutral"":0.7878358364105225,""happy"":0.25457727909088135,""anger/disgust"":0.019811689853668213,""sadness"":0.03333687782287598,""surprise"":0.008185443468391895,""fear"":0.0053401850163936615}"
"তাহলে আমার টা কই","","neutral",-0.1995357632637024,"{""neutral"":0.9578564763069153,""happy"":0.001190393464639783,""anger/disgust"":0.062131356447935104,""sadness"":0.0071779824793338776,""surprise"":0.00968765839934349,""fear"":0.0032039692159742117}"
"তাহলে ঘর পাচ্ছে কে? গরিব রা তো কুঁড়ে ঘরেই আছে,,,","","weaklyNegative",-0.5999159097671509,"{""neutral"":0.028765395283699036,""happy"":0.000878127699252218,""anger/disgust"":0.019007647410035133,""sadness"":0.9205123782157898,""surprise"":0.028727853670716286,""fear"":0.034744955599308014}"
"তাহলে প্রধানমন্ত্রী এতো এতো বাড়ি ঘর কার জন্য বানিয়ে দিলো,,","","neutral",0.154058575630188,"{""neutral"":0.12746986746788025,""happy"":0.004757043905556202,""anger/disgust"":0.4203921854496002,""sadness"":0.023512743413448334,""surprise"":0.4763445258140564,""fear"":0.010297579690814018}"
"তিন মাসের মধ্যে ভেঙে পরবে মনে হয়","","weaklyNegative",-0.5998645305633545,"{""neutral"":0.000825400638859719,""happy"":0.0005538463592529297,""anger/disgust"":0.0010071746073663235,""sadness"":0.9972018003463745,""surprise"":0.0007257038960233331,""fear"":0.00774071179330349}"
"তিনি ক্ষমতায় আসার পর থেকে পরিবহন ও যোগাযোগ ব্যবস্থায় ব্যাপক পরিবর্তন লক্ষণীয়। এটাই সবচেয়ে বড় সত্যি কথা।","","stronglyPositive",0.9998758792877198,"{""neutral"":0.027089303359389305,""happy"":0.9704322814941406,""anger/disgust"":0.0077421474270522594,""sadness"":0.008994179777801037,""surprise"":0.0880473256111145,""fear"":0.0020373526494950056}"
"তেল বাজের বাচ্চারা কোথায় এরা নাকি গরিব মানুষ চোখে দেখেনা ধন্যবাদ সাংবাদিক ভাই এদের চোখে আঙ্গুল দিয়ে দেখিয়ে দেওয়ার জন্য","","weaklyNegative",-0.5514771223068238,"{""neutral"":0.005983880255371332,""happy"":0.14635899662971497,""anger/disgust"":0.9499553442001343,""sadness"":0.03613816574215889,""surprise"":0.0034198262728750706,""fear"":0.0015950227389112115}"
"দক্ষিন এশিয়ায় বসবাসের জন্য সবচেয়ে ব্যায়বহুল দেশ #বাংলাদেশ🇧🇩https://fb.watch/cCfmTSBASd/","","stronglyPositive",0.9998639583587647,"{""neutral"":0.7553670406341553,""happy"":0.01307408232241869,""anger/disgust"":0.005397983361035585,""sadness"":0.36479833722114563,""surprise"":0.035221394151449203,""fear"":0.019580045714974403}"
"দিন বদলের অঙ্গিকার নিয়ে ২০০৯ সালের ৬ জানুয়ারি সরকার গঠন করে শেখ হাসিনা। দিন বদলের অঙ্গিকার নিয়ে এখনো সামনের দিকে এগিয়ে যাচ্ছে শেখ হাসিনা এবং তার দল।","","weaklyPositive",0.5999017477035523,"{""neutral"":0.019088612869381905,""happy"":0.9830842614173889,""anger/disgust"":0.003814845345914364,""sadness"":0.0018502639140933752,""surprise"":0.00529007613658905,""fear"":0.0004776889691129327}"
"দীর্ঘমেয়াদী পরিকল্পনা, এমডিজি অর্জন, এসডিজি বাস্তবায়নের প্রস্তুতিসহ, শিক্ষা, স্বাস্থ্য, লিঙ্গসমতা, কৃষিতে ব্যাপক উন্নয়ন, দারিদ্র্যসীমা হ্রাস, গড় আয়ু বৃদ্ধি, রফতানিমুখী শিল্পায়ন এবং বিশেষ অর্থনৈতিক অঞ্চল গড়ে তোলা, পোশাক শিল্প, ওষুধ শিল্প, রফতানি আয় বৃদ্ধিসহ নানা অর্থনৈতিক সূচক বৃদ্ধি প্রধানমন্ত্রী শেখ হাসিনার দূরদৃষ্টি ও পরিশ্রমের ফসল।","","stronglyPositive",0.9999265909194948,"{""neutral"":0.0003446998307481408,""happy"":0.9995439648628235,""anger/disgust"":0.000567579350899905,""sadness"":0.0014682399341836572,""surprise"":0.03868125379085541,""fear"":0.00027905896422453225}"
"দুঃখীত চাচী এই সিংগাপুরে ঘর পাওয়া যায় না","","weaklyNegative",-0.5998085021972657,"{""neutral"":0.002051542978733778,""happy"":0.0005302396020852029,""anger/disgust"":0.004425311926752329,""sadness"":0.9919111132621765,""surprise"":0.0027973479591310024,""fear"":0.011052686721086502}"
"দুর্যোগের খবর জানতে বিনা খরচে ১০৯০-তে কল করার বিষয়টিও ছিল অভিনব। ধন্যবাদ জননেত্রী শেখ হাসিনা।","","stronglyPositive",0.9997431039810182,"{""neutral"":0.009079793468117714,""happy"":0.9860308170318604,""anger/disgust"":0.003244431922212243,""sadness"":0.004520161543041468,""surprise"":0.12039896100759506,""fear"":0.0014780041528865695}"
"দেশরত্ন ❤️","","weaklyPositive",0.5923571586608888,"{""neutral"":0.3632151186466217,""happy"":0.6358137726783752,""anger/disgust"":0.040580809116363525,""sadness"":0.01543251983821392,""surprise"":0.01398960966616869,""fear"":0.00441599590703845}"
"দেশরত্ন জননেত্রী শেখ হাসিনার সরকার বারবার দরকার 👍✌️✌️","","stronglyPositive",0.9999437332153321,"{""neutral"":0.13187743723392487,""happy"":0.7463430762290955,""anger/disgust"":0.07888072729110718,""sadness"":0.007017422001808882,""surprise"":0.001211362425237894,""fear"":0.0006455166731029749}"
"দেশরত্ন শেখ হাসিনা","","stronglyPositive",0.9998709201812745,"{""neutral"":0.007792572025209665,""happy"":0.9911937117576599,""anger/disgust"":0.0022801754530519247,""sadness"":0.000524057075381279,""surprise"":0.0005931812920607626,""fear"":0.00008311449346365407}"
"দেশরত্ন শেখ হাসিনা আপার ❤️সঠিক নেতৃত্বে এগিয়ে যাবে দূর্বার গতিতে বাংলাদেশ ”জয় বাংলা জয় বঙ্গবন্ধু 🇧🇩✌️","","stronglyPositive",0.999932909011841,"{""neutral"":0.010037337429821491,""happy"":0.9925283193588257,""anger/disgust"":0.00047822020133025944,""sadness"":0.0002852072357200086,""surprise"":0.0017632010858505964,""fear"":0.0001262692385353148}"
"দেশের উন্নয়নের ধারাকে অব্যাহত রাখতে শেখ হাসিনার সরকার, এই দেশের জনগণের বারবার দরকার।","","stronglyPositive",0.9996997117996217,"{""neutral"":0.0073247128166258335,""happy"":0.9889110326766968,""anger/disgust"":0.0062913293950259686,""sadness"":0.0017723999917507172,""surprise"":0.0006868266500532627,""fear"":0.00015820993576198816}"
"দেশের মানুষ ঘর চায়না পদ্মার ব্রিজ চায়না শুধু ভোটাধিকার ফিরে পেতে চায়","","stronglyPositive",0.9995831966400148,"{""neutral"":0.028806697577238083,""happy"":0.016899997368454933,""anger/disgust"":0.847946286201477,""sadness"":0.1461079865694046,""surprise"":0.0052889673970639706,""fear"":0.003980225883424282}"
"দোয়া শুভ কামনা ও অভিনন্দন রইল। দেশ ও জাতির কল্যাণে বার বার দরকার শেখ হাসিনার সরকার। মহান আল্লাহ আপনি সকলের সাথে আমাদের প্রিয় নেত্রীকে সুস্থতা ও দীর্ঘায়ু কবুল করুন আমীন।😊","","stronglyPositive",0.9977400541305543,"{""neutral"":0.015086346305906773,""happy"":0.9897727370262146,""anger/disgust"":0.002476104535162449,""sadness"":0.002430651569738984,""surprise"":0.0051477584056556225,""fear"":0.0007650961633771658}"
"দ্য কিলার","","stronglyNegative",-0.9991386413574219,"{""neutral"":0.11645117402076721,""happy"":0.038675181567668915,""anger/disgust"":0.366201788187027,""sadness"":0.17384953796863556,""surprise"":0.18872956931591034,""fear"":0.15156516432762146}"
"ধন্যবাদ প্রথম আলো। দেশের উন্নয়নের ধারাবাহিকতা তোলে ধরার জন্য।","","stronglyPositive",0.9990418434143067,"{""neutral"":0.004938514903187752,""happy"":0.9961420893669128,""anger/disgust"":0.0008146301843225956,""sadness"":0.0004589940363075584,""surprise"":0.0007514760945923626,""fear"":0.00008771268767304718}"
"ধন্যবাদ মাননীয় প্রধানমন্ত্রী","","weaklyPositive",0.5967806816101076,"{""neutral"":0.053381722420454025,""happy"":0.9748436808586121,""anger/disgust"":0.0008922477718442678,""sadness"":0.0005855466588400304,""surprise"":0.001722610672004521,""fear"":0.0002821529342327267}"
"ধন্যবাদ মাননীয় প্রধানমন্ত্রী ।এত কটু কথা শুনেও দেশের জন্য নিরলস ভাবে কাজ করে যাচ্ছেন","","weaklyPositive",0.5565750360488892,"{""neutral"":0.005651916842907667,""happy"":0.9943528175354004,""anger/disgust"":0.0028003649786114693,""sadness"":0.0014183807652443647,""surprise"":0.009306173771619797,""fear"":0.00034295456134714186}"
"ধন্যবাদ মাননীয় প্রধানমন্ত্রী ❤️❤️","","weaklyPositive",0.41736235618591316,"{""neutral"":0.06019321829080582,""happy"":0.9717034697532654,""anger/disgust"":0.0005532965296879411,""sadness"":0.00031883313204161823,""surprise"":0.0012221448123455048,""fear"":0.00014334377192426473}"
"ধন্যবাদ মাননীয় প্রধানমন্ত্রী কে। এরকম ধন্যবাদ আরো অনেক পেতেন যদি দল এবং সরকারি প্রতিষ্ঠানগুলোকে দূর্নীতিমুক্ত করতে পারতেন।","","weaklyPositive",0.5336474418640138,"{""neutral"":0.022828076034784317,""happy"":0.9687886238098145,""anger/disgust"":0.03321770951151848,""sadness"":0.02165728248655796,""surprise"":0.003967791795730591,""fear"":0.0014564554439857602}"
"ধন্যবাদ মাননীয় প্রধানমন্ত্রী জননেত্রী শেখ হাসিনা","","stronglyPositive",0.9996944904327394,"{""neutral"":0.008576576597988605,""happy"":0.9942343831062317,""anger/disgust"":0.0004033836885355413,""sadness"":0.000250441167736426,""surprise"":0.0008520395494997501,""fear"":0.00008538598194718361}"
"ধন্যবাদ মাননীয় প্রধানমন্ত্রী জননেত্রী শেখ হাসিনা ❤️❤️","","stronglyPositive",0.9992430210113527,"{""neutral"":0.02492675371468067,""happy"":0.9857038855552673,""anger/disgust"":0.0003576283634174615,""sadness"":0.0002424782287562266,""surprise"":0.000982521683908999,""fear"":0.0000975561051745899}"
"ধন্যবাদ মাননীয় প্রধানমন্ত্রী বঙ্গবন্ধু শেখ হাসিনা'","","stronglyPositive",0.9997095823287965,"{""neutral"":0.009853340685367584,""happy"":0.9933328032493591,""anger/disgust"":0.0010163853876292706,""sadness"":0.0006961394101381302,""surprise"":0.0014644425828009844,""fear"":0.0001994505146285519}"
"ধন্যবাদ, প্রথম আলো 💜","","stronglyPositive",0.8565576553344727,"{""neutral"":0.033261459320783615,""happy"":0.9749497175216675,""anger/disgust"":0.0027782274410128593,""sadness"":0.0012497499119490385,""surprise"":0.002430875785648823,""fear"":0.00033913119114004076}"
"ধন্যবাদ, মাননীয় প্রধানমন্ত্রী♥","","weaklyPositive",0.485510802268982,"{""neutral"":0.11720933020114899,""happy"":0.9334099292755127,""anger/disgust"":0.0011519651161506772,""sadness"":0.001061485381796956,""surprise"":0.003617064794525504,""fear"":0.0004684537707362324}"
"ধন্যবাদ","","weaklyPositive",0.5999162435531618,"{""neutral"":0.054723139852285385,""happy"":0.9731386303901672,""anger/disgust"":0.0011517571983858943,""sadness"":0.000647725653834641,""surprise"":0.0013495126040652394,""fear"":0.0001856745220720768}"
"নারী উদ্যোক্তা ও ক্ষমতায়নে উৎসাহিতকরণে জয়িতা পুরস্কার তৃণমূলে একধরণের প্রতিযোগিতা তৈরি করেছে। জননেত্রী শেখ হাসিনা নারী উন্নয়নে অনেক বড় ভূমিকা রাখছে।","","stronglyPositive",0.9998955488204957,"{""neutral"":0.00045793058234266937,""happy"":0.9993258714675903,""anger/disgust"":0.000946046260651201,""sadness"":0.002441934309899807,""surprise"":0.004451584070920944,""fear"":0.00023408941342495382}"
"নারী ও শিশু নির্যাতন প্রতিরোধে ন্যাশনাল হেল্পলাইন ১০৯, জয় মোবাইল অ্যাপস যুগান্তকারী ভূমিকা রাখছে। ধন্যমান জননেত্রী শেখ হাসিনা।","","stronglyPositive",0.9999139547348024,"{""neutral"":0.0016962472582235932,""happy"":0.9978400468826294,""anger/disgust"":0.0020970122423022985,""sadness"":0.0017309091053903103,""surprise"":0.005077979527413845,""fear"":0.0003302037075627595}"
"নারীর প্রতি সহিংসতা রোধে পারিবারিক সহিংসতা প্রতিরোধ ও সুরক্ষা আইনটি ছিল সময়োপযোগী। ধন্যবাদ মাননীয় প্রধানমন্ত্রী শেখ হাসিনা।","","stronglyPositive",0.9923575401306153,"{""neutral"":0.001998441992327571,""happy"":0.9984344840049744,""anger/disgust"":0.0008612414821982384,""sadness"":0.0018366728909313679,""surprise"":0.0019259718246757984,""fear"":0.0003160169580951333}"
